index,published,topic,term,domain,language,valid,de,title,description,en,la,url,image,archive,content,quote,added,feed,country,ipcc,continent
96c7319b1273f4694efd9ee8ae04bfc1,2026-06-13T18:43:30Z,Precipitation,yağmur,www.odatv.com,tr,0.7,"Der Sonnenuntergang in Istanbul nach dem Regen war faszinierend. Der starke Regen, der den ganzen Tag über in der Millionenstadt anhielt, wich einem visuellen Fest. Der Regenbogen- und Sonnenuntergangsblick, der nach dem Regen entstand, faszinierte die Menschen in Istanbul.",Yağmur sonrası İstanbul'da yaşanan gün batımı mest etti,Megakentte gün boyu süren sağanak yağış yerini görsel bir şölene bıraktı. Yağmur sonrası ortaya çıkan gökkuşağı ve gün batımı manzarası İstanbulluları adeta büyüledi.,The sunset in Istanbul after the rain was mesmerizing. The heavy rain that lasted throughout the day in the megacity gave way to a visual feast. The rainbow and sunset view that emerged after the rain fascinated the people of Istanbul.,Solis occasus in Istanbul post pluviam metiebatur. Imber gravis qui per diem duravit in megacity cessit ad festum visuale. Iris et occasus intuitus quae post pluviam emersit populos Istanbul fascinavit.,https://www.odatv.com/guncel/yagmur-sonrasi-istanbulda-yasanan-gun-batimi-mest-etti-120150782,https://img.odatv.com/rcman/Cw1280h720q95gc/storage/files/images/2026/06/13/yagmur-sonrasi-istanbulda-yasanan-gun-batimi-mest-etti-q3oa.jpg,,"stanbul'da gün boyu etkisini sürdüren yamurun ardndan ortaya çkan gökkua ve gün batm manzaras görsel ölen sundu.
Megakenti gün boyu etkisi altna alan saanak ya, akam saatlerinde yerini kartpostallk … [+299 chars]",,2026-06-16 06:14:00+00:00,wmo,Algeria,SAH,Africa
ac2366944952be84c13d603b60327d4e,2026-06-11T06:10:10Z,Thunderstorm,şiddetli hava,www.sabah.com.tr,tr,0.8,"AKTUELLE NACHRICHTEN WETTER! Wochenendplaner aufgepasst: Die Temperaturen sinken! Die Menschen, die in diesen Provinzen leben, gehen nicht ohne Regenschirm aus. Die neuesten Wettervorhersagekarten, die von der Generaldirektion Meteorologie (MGM) veröffentlicht werden, sind bahnbrechend. Unmittelbar nach der sengenden Hitze, die 37 Grad erreicht, kommt es zu einer Welle heftiger und donnernder Schauer, die das ganze Land erfassen wird. Was ist mit Istanbul, Izmir und Ankara?",SON DAKİKA HAVA DURUMU! Hafta sonu plan yapanlar dikkat: Sıcaklıklar çakılıyor! O illerde yaşayanlar şemsiyesiz çıkmayın,"Meteoroloji Genel Müdürlüğü’nün MGM yayımladığı son hava durumu tahmin haritaları adeta ezber bozdu. 37 dereceyi bulan kavurucu sıcakların hemen ardından tüm ülkeyi esir alacak şiddetli ve gök gürültülü sağanak dalgası geliyor. Peki İstanbul, İzmir ve Ankara’…","BREAKING NEWS WEATHER! Attention those making plans for the weekend: Temperatures are dropping! People living in those provinces, do not go out without an umbrella. The latest weather forecast maps published by the General Directorate of Meteorology (MGM) are a game changer. Immediately after the scorching heat, which reaches 37 degrees, comes a wave of heavy and thunderous showers that will capture the entire country. What about Istanbul, Izmir and Ankara…","BREAKING NEWS DIES! Operam facientium consilia volutpat: Temperaturae cadunt! Homines in his provinciis habitant, sine umbella non exeunt. Ultimae tempestatis praenuntiationes tabulae a Directoratu Generali Meteorologico (MGM) editae sunt lusus commutatoris. Statim post aestum, qui pervenerit 37 gradus, venit unda gravium et tonitruum imbrium, qui totam regionem capient. Quid de Istanbul, Smyrna et Ancyra…",https://www.sabah.com.tr/yasam/son-dakika-hava-durumu-hafta-sonu-plan-yapanlar-dikkat-sicakliklar-cakiliyor-o-illerde-yasayanlar-semsiyesiz-cikmayin-7600781,https://iasbh.tmgrup.com.tr/d167de/1200/675/0/0/2031/1143?u=https://isbh.tmgrup.com.tr/sbh/2026/06/11/son-dakika-hava-durumu-hafta-sonu-plan-yapanlar-dikkat-sicakliklar-cakiliyor-o-illerde-yasayanlar-semsiyesiz-c-1781157576127.jpg,,"METEOROLOJK GÖRÜNÜM
Meteoroloji Genel Müdürlüü tarafndan yaplan son deerlendirmelere göre: Ülkemiz genelinin parçal, yer yer çok bulutlu, Bat Akdeniz'in iç kesimleri, Dou Akdeniz, Dou Karadeniz, Dou… [+597 chars]",,2026-06-16 06:14:00+00:00,random,,,
2430ec32596a35dca0582109fc524707,2026-06-10T18:48:20Z,Precipitation,yağmur,www.hurriyet.com.tr,tr,0.9,"Last-Minute-Wettervorhersagen nach Provinz | Wie wird das Wetter morgen (11. Juni) sein? Wird es in Istanbul regnen? Starkregenwarnung der Meteorologie für 6 Provinzen! Wettervorhersagen wurden Provinz für Provinz mit dem Last-Minute-Bericht von Meteorology veröffentlicht. Während das heiße Wetter in vielen Teilen des Landes wirksam war, wurde für einige Provinzen eine Warnung vor starkem Regen ausgegeben. Nach den neuesten Wetterberichten der Generaldirektion für Meteorologie ist Artv...",Son dakika hava durumu tahminleri il il | Yarın (11 Haziran) hava nasıl olacak? İstanbul'da yağmur yağacak mı? Meteoroloji'den 6 ile kuvvetli yağış uyarısı!,Hava durumu tahminleri il il Meteoroloji'nin son dakika raporu ile yayınlandı. Sıcak hava yurdun birçok bölgesinde etkili olurken bazı iller için kuvvetli yağış uyarısı geldi. Meteoroloji Genel Müdürlüğü'nün son hava durumu değerlendirmelerine göre yarın Artv…,"Last minute weather forecasts by province | What will the weather be like tomorrow (June 11)? Will it rain in Istanbul? Heavy rain warning from Meteorology for 6 provinces! Weather forecasts were published province by province with the last minute report of Meteorology. While the hot weather was effective in many parts of the country, a heavy rain warning was issued for some provinces. According to the latest weather assessments of the General Directorate of Meteorology, Artv...","Last minute forecasts by province | Quid tempestas erit cras (Juni 11)? Pluetne in Istanbul? Imber gravis admonitio Meteororum pro 6 provinciis! Praenuntiationes tempestatum provinciae per provinciam cum ultimo momento relationem Meteorologicorum divulgatae sunt. Dum aestus in multis regionibus valuit, pluviae monitum in aliquas provincias prolatum est. Secundum recentissimas tempestates aestimationes Directoratus Generalis Meteorologici, Artv...",https://www.hurriyet.com.tr/bilgi/son-dakika-hava-durumu-tahminleri-il-il-yarin-11-haziran-hava-nasil-olacak-istanbulda-yagmur-yagacak-mi-meteorolojiden-6-ile-43200810,https://image.hurimg.com/i/hurriyet/90/0x0/6a29b0f9f67bd186f7d470d6.jpg,,"p&gt;Meteoroloji Genel Müdürlüü tarafndan yaplan son deerlendirmelere göre, ülkemiz genelinin parçal, yer yer çok bulutlu, Akdeniz (Antalya ve Hatay hariç), Dou Karadeniz, Dou Anadolu (Elaz ve rnak h… [+4422 chars]",,2026-06-16 06:14:00+00:00,wmo,Algeria,SAH,Africa
f8259f1e1f9a511dda5cdd029be9e2b9,2026-06-13T13:33:00Z,Thunderstorm,dolu,video.haber7.com,tr,0.9,Hagel und Regen brachten das Leben in Ankara zum Erliegen! Der plötzliche starke Regen und Hagel in Ankara verursachten Überschwemmungen in vielen Teilen der Stadt. Viele Straßen und Wege verwandelten sich in Seen.,Ankara'da dolu ve sağanak hayatı durma noktasına getirdi!,"Ankara’da aniden bastıran sağanak yağmur ve dolu, kentin birçok yerinde su baskınlarına neden oldu. Birçok cadde ve yol göle döndü.",Hail and showers brought life to a halt in Ankara! The sudden heavy rain and hail in Ankara caused floods in many parts of the city. Many streets and roads turned into lakes.,Ave et imbres vitam in Ancyra sistere! Subitus pluviae gravis et grando in Ancyra multas urbis partes inundationes effecit. Multae plateae et viae in lacus verterunt.,https://video.haber7.com/video-galeri/367359-ankarada-dolu-ve-saganak-hayati-durma-noktasina-getirdi,https://i12.haber7.net//fotogaleri/haber7/video/player/2026/24/ankarada_dolu_ve_saganak_hayati_durma_noktasina_getirdi_1781357477_6573.jpg,,"Ankarada aniden bastran saanak yamur ve dolu, kentin birçok yerinde su basknlarna neden oldu. Birçok cadde ve yol göle döndü.
Ankara'nn birçok ilçesinde öle saatlerinde dolu ve saanak ya etkili oldu… [+758 chars]",,2026-06-16 06:14:00+00:00,random,,,
62f25fba4a49239e4b14b4ca0c7e6ffc,2026-06-05T14:06:17Z,Snow&Ice,don,www.sabah.com.tr,tr,0.7,"Sprecherin des russischen Außenministeriums Sacharowa: „Die Ukraine hat Frachtschiffe im Asowschen Meer angegriffen.“ Die Sprecherin des russischen Außenministeriums, Mariya Zaharova, erklärte, dass der Angriff auf die Frachtschiffe Natra und Zircon, die von Türkiye zum Hafen von Rostow am Don im Asowschen Meer fuhren, von der Ukraine ausgeführt wurde. Auf beiden Schiffen gab es Tote und Verwundete…","Rusya Dışişleri Bakanlığı Sözcüsü Zaharova: ""Azak Denizi'ndeki yük gemilerine Ukrayna saldırdı""","Rusya Dışişleri Bakanlığı Sözcüsü Mariya Zaharova, Azak Denizi’nde Türkiye’den Rostov-on-Don limanına doğru seyreden Natra ve Zirkon yük gemilerine yönelik saldırının Ukrayna tarafından gerçekleştirildiğini ifade etti. Her iki gemide de ölü ve yaralıların yer…","Russian Foreign Ministry Spokesperson Zakharova: ""Ukraine attacked cargo ships in the Sea of ​​Azov"". Russian Foreign Ministry Spokesperson Mariya Zaharova stated that the attack on the Natra and Zircon cargo ships sailing from Turkey to the port of Rostov-on-Don in the Sea of ​​Azov was carried out by Ukraine. There were dead and injured people on both ships.","Russian Ministerio Externorum Spokesperson Zakharova: ""Ucraina naves onerarias in Mare Maeotium oppugnavit"". Russian Ministry Externorum Spokesperson Mariya Zaharova affirmavit impetum in Natra et Zircon naves onerarias a Türkiye navigantes ad portum Rostov-on-Don in Mare Maeotim ab Ucraina allatum esse. In utroque navibus mortui sunt et vulnerati.",https://www.sabah.com.tr/dunya/rusya-disisleri-bakanligi-sozcusu-zaharova-azak-denizindeki-yuk-gemilerine-ukrayna-saldirdi-7597374,https://iasbh.tmgrup.com.tr/45d1ab/1200/675/0/11/831/479?u=https://isbh.tmgrup.com.tr/sbh/2026/06/05/rusya-disisleri-bakanligi-sozcusu-zaharova-azak-denizindeki-yuk-gemilerine-ukrayna-saldirdi-1780668371727.png,,"Sözcü Zaharova, Azak Denizi'nde Belize bandral Natra ve Palau bandral Zirkon yük gemilerine gerçekletirilen insansz hava arac (HA) saldrsna ilikin açklama yapt.
Saldrnn Ukrayna tarafndan düzenlendii… [+1626 chars]",,2026-06-17 14:10:44+00:00,random,,,
0edc8852586f37447a5330a749d112a2,2026-06-11T20:21:18Z,Snow&Ice,don,www.wonkette.com,tr,0.7,"Der zu Fauxpas neigende Sleepy Don macht quasi kostenlose Werbung für Demokraten!. Werde satt, voll, voll, voll!",Gaffe-Prone Sleepy Don Making All Kinda Free Ads For Democrats!,Doy doy doy doy doy!,"Gaffe-Prone Sleepy Don Making All Kinda Free Ads For Democrats!. Get full, full, full, full!","Gaffe-Prone Sleepy Don Making All Kinda Free Ads For Democrats!. Plenus, plenus, plenus, plenus!",https://www.wonkette.com/p/gaffe-prone-sleepy-don-making-all,"https://substackcdn.com/image/fetch/$s_!PFFp!,w_1200,h_675,c_fill,f_jpg,q_auto:good,fl_progressive:steep,g_auto/https%3A%2F%2Fsubstack-post-media.s3.amazonaws.com%2Fpublic%2Fimages%2Fb2119f4d-b6cf-477b-bbf1-ab8f48f6174b_1002x474.png",,"We dont know if this is related to whatever is requiring 22 specialists at a time to examine Donald Trumps very good brain and beautiful body, But Axios has noticed that Trump simply cannot stop maki… [+3323 chars]",,2026-06-17 14:10:44+00:00,random,,,
99aa98678a76df7fdff8ecffd342429e,2026-06-04T09:03:00Z,Snow&Ice,don,ekonomi.haber7.com,tr,0.9,"Ein Rekordjahr in der Landwirtschaft: Fülle an Ständen und ein Höhepunkt bei den Exporten werden erwartet. Nach dem Frost und der Dürre im letzten Jahr wird mit den effektiven Regenfällen in diesem Jahr ein historischer Rekord in der landwirtschaftlichen Produktion erwartet. Riesige Steigerungen der Obstproduktion von bis zu 57,8 Prozent werden sich im Sommer in Hülle und Fülle für die Verbraucher niederschlagen.","Tarımda rekor yılı: Tezgahlarda bolluk, ihracatta zirve bekleniyor","Geçen yıl yaşanan don ve kuraklığın ardından bu yıl etkili olan yağışlarla, tarımsal üretimde tarihi bir rekor bekleniyor. Meyve üretiminde yüzde 57,8'e varan dev artışlar yaz döneminde tüketiciye bolluk olarak yansıyacak.","A record year in agriculture: Abundance in stalls and a peak in exports are expected. After last year's frost and drought, a historical record is expected in agricultural production with the effective rains this year. Huge increases of up to 57.8 percent in fruit production will be reflected in abundance to the consumer during the summer period.","Annus in agricultura: Abundantia in praesepibus et cacumen in exportationibus expectatur. Post annum gelu et siccitatem historicus recordatio exspectatur in productione agriculturae cum effectivis imbribus hoc anno. Ingens incrementa usque ad 57,8 cento in fructu productionis abundanter reddentur consumptoribus tempore aestatis.",https://ekonomi.haber7.com/ekonomi/haber/3632991-tarimda-rekor-yili-tezgahlarda-bolluk-ihracatta-zirve-bekleniyor,https://i12.haber7.net//haber/haber7/og_image/2026/23/tarimda_rekor_yili_tezgahlarda_bolluk_ihracatta_zirve_bekleniyor_1780563414_7357.jpg,,"Türkiye genelinde hava scaklklarnn mevsim normallerinde seyretmesi ve son yllarn yalarn almas, tarm sektöründe yüzleri güldürdü.
Tarmda bu yl rekor beklentisi artarken geçen yl dondan etkilenen meyv… [+3618 chars]",,2026-06-17 14:10:44+00:00,random,,,
7676bc973fae41dabbf5cd3081030882,2026-06-14T04:00:00Z,Thunderstorm,dolu,www.hurriyet.com.tr,tr,0.9,"„Ich wünschte, ich hätte nie geschrieben und könnte wieder schreiben.“ Mahir Ünsal Eriş, einer der beliebtesten Autoren unserer zeitgenössischen Literatur, nimmt den Leser in seinem neuen Roman „Wörterbuch der Wunder“ mit auf eine Reise voller Überraschungen, wundersamer Geschichten und farbenfroher Charaktere in die osmanische Geographie. Für seinen 952-seitigen Roman sagte Eriş: „Zähle Schläge in einem Kampf …“",‘Hiç yazmamış olmayı ve yeniden yazabilmeyi isterdim’,"Çağdaş edebiyatımızın en sevilen yazarlarından Mahir Ünsal Eriş yeni romanı ‘Harikalar Lügati’nde okuru Osmanlı coğrafyasında sürprizli, mucizeli hikâyeler ve renkli karakterlerle dolu bir yolculuğa çıkarıyor. Eriş 952 sayfalık romanı için “Kavgada yumruk say…","'I wish I had never written and could write again.' Mahir Ünsal Eriş, one of the most popular writers of our contemporary literature, takes the reader on a journey full of surprises, miraculous stories and colorful characters in the Ottoman geography in his new novel 'Dictionary of Wonders'. For his 952-page novel, Eriş said, “Count punches in a fight…","'Vellem numquam scripsissem et iterum scribere possem.' Mahir Ünsal Eriş, unus e celeberrimis scriptoribus nostrae aetatis nostrae, lectorem in itinere admirationis, miraculorum historiarum ac colorum ingenia in Ottomanico geographia in nova nova 'Dictionary Miraculorum' accipit. Pro sua pagina nova 952 dixit Eriş: “Comes pugnis in pugna…",https://www.hurriyet.com.tr/kelebek/hurriyet-pazar/hic-yazmamis-olmayi-ve-yeniden-yazabilmeyi-isterdim-43204501,https://image.hurimg.com/i/hurriyet/90/0x0/6a2dca3aa0785b4dfe6ed295.jpg,,"p&gt;Mahir Ünsal Eriin yeni roman, tam adyla Mehmet Nüvid Beyin Harikalar Lügatinin 17 Haziranda raflarda olaca haberini duyar duymaz Doan Kitap aryorum. Roman yaymlanmadan okuyup sonrasnda da uzun s… [+7517 chars]",,2026-06-17 14:10:44+00:00,random,,,
f612d93530da52b88cd5439745cd9517,2026-06-03T13:41:00Z,Thunderstorm,fırtına,video.haber7.com,tr,0.9,Im Studio herrschte ein Sturm der Aufregung! Millionen von Menschen saßen bei der 500.000-Lira-Frage vor dem Bildschirm. Die beliebte Quizshow 30 Seconds auf den Bildschirmen von Channel 7 erwartet das Publikum heute mit einem Hauptpreis von 500.000 TL.,Stüdyoda heyecan fırtınası koptu! 500 bin liralık soruda milyonlar ekrana kilitlendi,"Kanal 7 ekranlarının sevilen bilgi yarışması 30 Saniye, bugün büyük ödülü olan 500 bin TL ile izleyicilerle buluşuyor.Yarışmaya",There was a storm of excitement in the studio! Millions of people were glued to the screen on the 500 thousand lira question. The popular quiz show 30 Seconds on Channel 7 screens meets the audience today with its grand prize of 500 thousand TL.,Tempestas tumultus in studio! Ingentium decies centena milia hominum in quaestionis scrinii ad mille lira centum affixa sunt. Quiz popularis spectaculum 30 Secundi in Channel 7 screens audientibus hodie convenit cum praemio magnifico 500 milium TL.,https://video.haber7.com/video-galeri/366341-studyoda-heyecan-firtinasi-koptu-500-bin-liralik-soruda-milyonlar-ekrana-kilitlendi,https://i12.haber7.net//fotogaleri/haber7/video/player/2026/23/studyoda_heyecan_firtinasi_koptu_500_bin_liralik_soruda_milyonlar_ekrana_kilitlendi_1780493741_8071.jpg,,"Kanal 7 ekranlarnn sevilen bilgi yarmas 30 Saniye, bugün büyük ödülü olan 500 bin TL ile izleyicilerle buluuyor.
Yarmaya zmir'den  katlan ve Çalar, renkli kiilii ve samimi sohbetiyle programa farkl … [+303 chars]",,2026-06-17 18:04:06+00:00,random,,,
f12b075e8ba277afd072165d8d522449,2026-06-10T14:22:00Z,Storm,fırtına,www.hurriyet.com.tr,tr,0.9,"Ein Sturm der Emotionen im Finale von Eşref Rüya! Die Phänomenserie Eşref Rüya von Kanal D wird heute Abend mit ihrer spannenden und emotionalen Schlussfolge vor das Publikum treten. Unvergessliche Momente erwarten das Publikum in der Folge, in der jahrelange Kämpfe, große Lieben und unvollendete Berichte zu Ende gehen.",Eşref Rüya finalinde duygu fırtınası!,"Kanal D'nin fenomen dizisi Eşref Rüya, bu akşam heyecan ve duygu yüklü final bölümüyle izleyici karşısına çıkacak. Yıllardır süren mücadelelerin, büyük aşkların ve yarım kalan hesapların son bulacağı bölümde izleyicileri unutulmaz anlar bekliyor.","A storm of emotions in the finale of Eşref Rüya! Kanal D's phenomenon series Eşref Rüya will appear before the audience this evening with its exciting and emotional final episode. Unforgettable moments await the audience in the episode where years of struggles, great loves and unfinished accounts will come to an end.","Procella affectuum in ultimo Eşref Rüya! Kanal D's phaenomenon series Eşref Rüya coram auditoribus apparebit hac vespera cum eventu finali motus excitandi. Momenta nulla memorabilia exspectant auditorem in facto ubi certaminum anni, magni amores et rationes infectae desinunt.",https://www.hurriyet.com.tr/kelebek/televizyon/esref-ruya-finalinde-duygu-firtinasi-43200583,https://image.hurimg.com/i/hurriyet/90/0x0/6a29730af67bd186f7d4700c.jpg,,"p&gt;""BU GECE BURADA ÖLECEM""Duygu dolu anlarn yaanaca final bölümünün tantmnda Eref, kaderiyle yüzleiyor: Ben muhtemelen bu gece burada öleceim. Korkmuyorum. Uzun zamandr hazrm buna. Rüya ise geçmie … [+950 chars]",,2026-06-17 18:04:06+00:00,random,,,
dc538cbeb56e69a0f773f7f139d79bf8,2026-06-16T09:07:16Z,Drought,kuruluk estonya,www.chip.com.tr,tr,0.3,"15 Grad mitten im Winter: Die Antarktis schlägt Alarm. Auf der Antarktischen Halbinsel wurde im Juni mit 15,4 Grad ein Winterrekord gebrochen. Diese Temperatur, die 20 Grad über der saisonalen Norm liegt, bereitet den Wissenschaftlern große Sorgen.",Kış ortasında 15 derece: Antarktika alarm veriyor,"Antarktika Yarımadası'nda Haziran ayında 15.4 dereceyle kış rekoru kırıldı. Mevsim normallerinin 20 derece üzerindeki bu sıcaklık, bilim insanlarını ciddi anlamda endişelendiriyor.","15 degrees in the middle of winter: Antarctica sounds the alarm. A winter record was broken in the Antarctic Peninsula in June with 15.4 degrees. This temperature, which is 20 degrees above seasonal norms, seriously worries scientists.","15 gradus in media hieme: Antarctica terrorem sonat. Mensura hiemalis in paeninsula Antarctica mense Iunio cum 15.4 gradibus fracta est. Haec temperatura, quae est 20 gradus supra normas temporis temporarias, serio curarum scientiarum.",https://www.chip.com.tr/guncel/kis-ortasinda-15-derece-antarktika-alarm-veriyor_181085.html,https://img.chip.com.tr/rcman/Cw1280h720q95gm/storage/files/images/2026/06/15/kuresel-isinma-hizinin-tam-bes-kati-bir-suratle-isinan-antarktika-yarimadasi-koyu-renkli-okyanus-yuzeyinin-gunes-isisini-hapsetmesiyle-baslayan-kisir-dongu-zagg.jpg,,"Haziran ayında Antarktika'da termometreler 15 dereceyi gösterdi. Bu cümleyi bir daha okuyun; çünkü söz konusu yer, yılın bu döneminde dondurucu soğuğun hüküm sürmesi gereken kutup kıtası.
Arjantin'e… [+1839 chars]",,2026-06-17 22:24:05+00:00,edo,Estonia,NEU,Europe
75ad751105bc3278fa9aca06ccb08348,2026-06-10T16:09:00Z,Earthquake,deprem feke,www.haber7.com,tr,0.7,"In Adana ereignete sich ein Erdbeben der Stärke 3,9. Eilmeldung: Im Distrikt Feke in Adana ereignete sich ein Erdbeben der Stärke 3,9.","Adana'da 3,9 büyüklüğünde deprem meydana geldi","Son dakika haberi... Adana'nın Feke ilçesinde 3,9 büyüklüğünde deprem meydana geldi.",A 3.9 magnitude earthquake occurred in Adana. Breaking news... A 3.9 magnitude earthquake occurred in Feke district of Adana.,A 3.9 Magnitudo terrae motus factus est in Adana. Magnitudo terrae motus in Feke regione Adana facta est.,https://www.haber7.com/guncel/haber/3634623-adanada-39-buyuklugunde-deprem-meydana-geldi,https://i12.haber7.net//haber/haber7/og_image/2026/24/adanada_39_buyuklugunde_deprem_meydana_geldi_1781107481_2901.jpg,,"SON DAKKAHABER: Afet ve Acil Durum Yönetimi Bakanlndan yer alan verilere göre Adana'nn Feke ilçesinde bir deprem meydana geldi.
ADANA'DA DEPREM
Saat 18.43'te meydana gelen depremin büyüklüünün 3,9 … [+100 chars]",,2026-06-18 09:57:36+00:00,usgs,Turkey,MED,Asia
3d811918ddd3dbd93e014bceeb64491d,2026-06-15T09:52:44Z,Storm,fırtına,www.yenicaggazetesi.com,tr,0.9,"Schwere Sturmwarnung für 80 Millionen Menschen im Osten der USA. Für etwa 80 Millionen Menschen, die im breiten Oststreifen der Vereinigten Staaten von Georgia bis Maine leben, wurde eine schwere Sturmwarnung herausgegeben.",ABD’nin doğusunda 80 milyon kişiye şiddetli fırtına uyarısı,Amerika Birleşik Devletleri'nin Georgia eyaletinden Maine eyaletine kadar uzanan geniş doğu şeridinde yaşayan yaklaşık 80 milyon kişi için şiddetli fırtına uyarısı yapıldı.,Severe storm warning for 80 million people in the eastern United States. A severe storm warning has been issued for approximately 80 million people living in the wide eastern strip of the United States stretching from Georgia to Maine.,Tempestas gravis admonetur de 80 miliones hominum in Civitatibus Foederatis Americae orientalibus. Gravis tempestas admonitionis circiter 80 miliones hominum in lato orientali plaga Civitatum Americae Unitarum a Georgia usque ad Cenamiam tendentes edita est.,https://www.yenicaggazetesi.com/abdnin-dogusunda-80-milyon-kisiye-siddetli-firtina-uyarisi-1040759h.htm,https://img.yenicaggazetesi.com/rcman/Cw1280h720q95gc/storage/files/images/2026/06/15/abdnin-dogusunda-80-milyon-kisiye-siddetli-firtina-uyarisi-r8dg.jpg,,"Amerika Birleşik Devletleri (ABD), aynı anda hem şiddetli fırtına hem de aşırı sıcak hava dalgalarıyla mücadele ediyor. ABC News'in meteoroloji yetkililerine dayandırdığı bilgilere göre, ülkenin doğu… [+1050 chars]",,2026-06-18 13:50:52+00:00,random,,,
fa7a28798992288dd1f9c809a10da02a,2026-06-12T09:33:53Z,Heat Wave,en sıcak yıl,www.hurriyet.com.tr,tr,0.8,"Der Bezirk, in dem in Türkiye die höchste Temperatur gemessen wurde, wurde bekannt gegeben. Während die Durchschnittstemperaturen in Türkiye im Mai 1,4 Grad unter den saisonalen Normen lagen, wurde der Mai 2026 als der siebtkälteste Mai der letzten 56 Jahre verzeichnet. Andererseits ist die niedrigste Temperatur im Mai in Ardahan mit 2 Grad unter Null,…",Türkiye'de en yüksek sıcaklığın ölçüldüğü ilçe belli oldu,"Türkiye'de mayıs ayında ortalama sıcaklıklar mevsim normallerinin 1,4 derece altında gerçekleşirken, 2026 yılı mayısı son 56 yılın en soğuk 7'nci mayısı olarak kayıtlara geçti. Öte yandan Mayıs ayında en düşük sıcaklık sıfırın altında 2 derece ile Ardahan'da,…","The district where the highest temperature was measured in Türkiye has been announced. While average temperatures in Türkiye in May were 1.4 degrees below seasonal norms, May 2026 was recorded as the 7th coldest May of the last 56 years. On the other hand, the lowest temperature in May is in Ardahan with 2 degrees below zero,…","Regio ubi summa temperies Türkiye mensuratus est, nuntiatum est. Dum mediocris temperaturae in Türkiye mense Maio 1.4 gradus infra normas temporarias erant, Maius 2026 commemorabatur sicut VII frigidissimi Maii anni ultimi 56 anni. E contra, temperatura infima in Maio est in Ardahan cum 2 gradibus infra zerum,…",https://www.hurriyet.com.tr/gundem/turkiyede-en-yuksek-sicakligin-olculdugu-ilce-belli-oldu-43202745,https://image.hurimg.com/i/hurriyet/90/0x0/6a2bd220613bd91eccb0840f.jpg,,"p&gt;Çevre, ehircilik ve klim Deiiklii Bakanl Meteoroloji Genel Müdürlüü verilerinden derlenen bilgilere göre, geçen ay scaklklar, Marmara Bölgesi'nin tamam, Karadeniz ve Ege Bölgesi'nin ky kesimleri… [+4014 chars]",,2026-06-18 18:17:13+00:00,random,,,
