index,published,topic,term,domain,language,valid,de,title,description,en,la,url,image,archive,content,quote,added,feed,country,ipcc,continent
faa17b058f17f4477d6cd9c8b4906c0c,2026-03-07T08:02:27Z,Heat Wave,ısı,www.yenicaggazetesi.com,tr,0.9,"In den Tiefen des Ozeans wurde eine „tickende Zeitbombe“ gelegt: ein beängstigendes Szenario einer Klimakatastrophe. Die wissenschaftliche Welt wurde durch die GEOMAR-Forschung vom 15. Oktober 2025 erschüttert. Die Daten bewiesen, dass selbst wenn die Menschheit ihre Emissionen auf Null reduzieren würde, die riesige, in den Tiefen des Ozeans eingeschlossene Wärme Jahrhunderte später an die Oberfläche strömen und die globale Erwärmung erneut auslösen würde.",Okyanusun derinliklerinde 'saatli bomba' kuruldu: iklim felaketinde korkutan senaryo,"Bilim dünyası, 15 Ekim 2025 tarihli GEOMAR araştırmasıyla sarsıldı. Veriler, insanlık emisyonları sıfırlasa bile okyanusun derinliklerine hapsolmuş devasa ısının yüzyıllar sonra yüzeye fışkırarak küresel ısınmayı yeniden başlatacağını kanıtladı.","A 'ticking time bomb' was set in the depths of the ocean: a frightening scenario in a climate disaster. The scientific world was shaken by the GEOMAR research dated October 15, 2025. The data proved that even if humanity zeroed out emissions, the huge heat trapped in the depths of the ocean would gush to the surface centuries later, restarting global warming.","""Tempus ticking bomba"" in profundo oceani posita est: missionem terribilis in calamitate climatis. Mundus scientificus concussus est investigationis GEOMAR sub die 15 mensis Octobris anno 2025. Notitia probavit, etiamsi humanitas emissiones verteret, ingens calor in profundo oceani comprehensus scaturientibus in superficiebus post saeculis, calefactionem globalem sileo.",https://www.yenicaggazetesi.com/okyanusun-derinliklerinde-saatli-bomba-kuruldu-iklim-felaketinde-korkutan-senaryo-1006836h.htm,https://img.yenicaggazetesi.com/rcman/Cw1280h720q95gc/storage/files/images/2026/03/07/okyanusun-derinliklerinde-saatli-bomba-kuruldu-iklim-felaketinde-korkutan-senaryo-v7aj.jpg,,"İnsanlığın son yüzyılda ürettiği karbon kirliliğinin çeyreğini ve aşırı ısının yüzde 90’ından fazlasını bir sünger gibi emen Güney Okyanusu, artık kapasitesinin sonuna geldi.
GEOMAR Helmholtz Okyanu… [+1112 chars]",,2026-03-10 21:01:43+00:00,random,,,
3f3b847ad7e79d7ebe011861258c1f16,2026-03-04T07:02:21Z,Drought,kuraklık,www.hurriyet.com.tr,tr,0.9,"Extreme Wetterereignisse sind zur Normalität geworden, 1 Jahr Dürre, 1 Jahr Überschwemmung! „Eine systematische Vorbereitung ist ein Muss.“ Vorstandsmitglied der Kammer der Umweltingenieure in Antalya, Assoc. Dr. Güray Doğan erklärte, dass extreme Wetterereignisse mit dem Klimawandel zugenommen hätten und sagte: „Ein Jahr Dürre und ein Jahr extrem regnerischer Perioden sind zur Normalität geworden. Schwere Dürreperioden sind Perioden der Bodendegradation.“","Aşırı hava olayları normalleşti, 1 yıl kuraklık, 1 yıl sel! 'Sistematik hazırlık şart'","Çevre Mühendisleri Odası Antalya Şubesi Yönetim Kurulu Üyesi Doç. Dr. Güray Doğan, iklim değişikliği ile birlikte aşırı hava olaylarının arttığını belirterek, ""1 sene kurak, 1 sene aşırı yağışlı dönemler artık normalleşti. Ciddi kuraklık dönemleri toprağın ge…","Extreme weather events have become normal, 1 year of drought, 1 year of flood! 'Systematic preparation is a must'. Chamber of Environmental Engineers Antalya Branch Board Member Assoc. Dr. Güray Doğan stated that extreme weather events have increased with climate change and said, ""One year of drought and one year of extremely rainy periods have become normal. Severe drought periods are periods of soil degradation.""","Eventus extremae tempestatis normales facti sunt, 1 annus siccitatis, 1 annus diluvii! ""Praeparatio systematica est musti"". Cubiculum machinarum Environmentalium Antalyae germen Board Member Assoc. Dr. Güray Doğan affirmavit extremas rerum tempestates cum mutatione climatis auctas esse et dixit ""Unus annus siccitatis et unus annus valde pluviosus nunc normales facti sunt. Gravis siccitas periodi soli periodi sunt.",https://www.hurriyet.com.tr/gundem/asiri-hava-olaylari-normallesti-1-yil-kuraklik-1-yil-sel-sistematik-hazirlik-sart-43120930,https://image.hurimg.com/i/hurriyet/90/0x0/69a7d8e8717271c959b2bfe3.jpg,,"p&gt;Çevre Mühendisleri Odas Antalya ubesi Yönetim Kurulu Üyesi ve Akdeniz Üniversitesi (AÜ) Mühendislik Fakültesi Çevre Mühendislii Bölümü'nden Doç. Dr. Güray Doan, son dönemde artan iddetli yalarn … [+2417 chars]",,2026-03-11 06:10:56+00:00,random,,,
a14801e069e9302d31200028024e7428,2026-03-10T09:09:45Z,Cold Wave,en soğuk gün,www.chip.com.tr,tr,0.8,"Was war die niedrigste Temperatur, die jemals auf der Erde gemessen wurde? Hier ist der kälteste Ort auf dem Planeten! Wir wissen nicht, welche Art von Kälte Ihnen in den Sinn kommt, wenn Sie an kalte Winterbedingungen denken ... Aber es gibt einen Ort auf der Erde, an dem noch nie zuvor jemand eine so niedrige Temperatur gesehen hat ...",Dünya'da ölçülmüş en düşük sıcaklık kaç dereceydi? İşte gezegenin en soğuk yeri!,"Soğuk kış koşulları dendiğinizde aklınıza nasıl bir soğuk geliyor, bilemiyoruz... Ama Dünya'da öyle bir yer var ki, bugüne dek kimse, herhangi bir yerde böylesine düşük bir sıcaklık görmedi...",What was the lowest temperature ever measured on Earth? Here is the coldest place on the planet! We don't know what kind of cold comes to mind when you think of cold winter conditions... But there is a place on Earth where no one has ever seen such a low temperature anywhere before...,Quid infimus temperatus unquam in Terra mensus est? Hic locus frigidissimus est in planeta! Nescimus qualia frigora in mentem tuam veniant cum conditiones hiemis frigidas cogitas... Sed locus in terra est ubi nemo unquam tam humilem temperaturam usquam prius vidit.,https://www.chip.com.tr/guncel/dunyada-olculmus-en-dusuk-sicaklik-kac-dereceydi-iste-gezegenin-en-soguk-yeri_175107.html,https://img.chip.com.tr/rcman/Cw1280h720q95gm/storage/files/images/2025/11/27/dunyanin-en-soguk-yeri-neresi-antarktikada-olculen-rekor-ve-laboratuvarda-kirilan-inanilmaz-sinir-kljq.jpg,,"Issız bir çöl olan Doğu Antarktika Platosu Dünya üzerindeki en soğuk yer olarak biliniyor. Burada, 23 Temmuz 1983’te, Rusya’ya ait Vostok İstasyonu’nda hava sıcaklıkları ortalamanın oldukça altında, … [+2282 chars]",,2026-03-12 16:37:34+00:00,random,,,
21913c8c753244f0ceaea5fc4823eeaf,2026-03-05T07:16:00Z,Snow&Ice,don,www.haber7.com,tr,0.9,"Die Stadt erstarrte buchstäblich! Die Thermometer zeigten minus 20 Grad. Im Erzurumer Stadtteil Pasinler sank die Lufttemperatur auf 20 Grad unter Null. Während das kalte Wetter weiterhin der Stadt zusetzte, fror auch der Demirdöven-Staudamm zu.",Kent adeta buz tuttu! Termometreler eksi 20'yi gördü,"Erzurum'un Pasinler ilçesinde hava sıcaklığı sıfırın altında 20 derecelere kadar düştü. Kentte soğuk hava etkisini sürdürürken, Demirdöven Barajı da dondu.","The city literally froze! Thermometers hit minus 20. In Erzurum's Pasinler district, the air temperature dropped to 20 degrees below zero. While the cold weather continued to affect the city, Demirdöven Dam also froze.","Urbs proprie adligat! Thermometri minus feriunt 20. In regione Erzuri Pasinler, temperatura aeris ad 20 gradus infra zerum decidit. Dum frigoris urbem afficerent, Demirdöven Dam etiam concrevit.",https://www.haber7.com/guncel/haber/3609385-kent-adeta-buz-tuttu-termometreler-eksi-20yi-gordu,https://i20.haber7.net/resize/1280x720//haber/haber7/photos/2026/10/kent_adeta_buz_tuttu_termometreler_eksi_20yi_gordu_1772694836_9315.jpg,,"Erzurum'da dondurucu souk hava etkisini sürdürmeye devam ediyor. ubat aynda bir hafta bahardan kalma günleri yaayan Erzurumda etkili olan kar yann ardndan souklar balad.
-20 DERECE GÖRÜLDÜ
Termomet… [+742 chars]",,2026-03-12 16:37:34+00:00,random,,,
9529753475fc61e4af84f87ecb5d790d,2026-03-01T08:22:00Z,Heat Wave,en sıcak yıl,ekonomi.haber7.com,tr,0.8,"USA und Israel haben den Iran angegriffen, ein Rekord von 53 Jahren wurde erreicht! Hier sind die Preise. Die Spannungen, die sich zu einem heißen Konflikt zwischen den USA und dem Iran entwickelten, lösten an den Märkten einen „Black Swan“-Effekt aus. Die Unze Gold stieg nach 53 Jahren sieben Monate in Folge aufgrund der Nachfrage nach sicheren Häfen, während das Gramm Gold die Grenze von 8.000 TL überschritt.",ABD ve İsrail İran'a saldırdı altında 53 yılın rekoru geldi! İşte fiyatlar,"ABD ve İran arasında sıcak çatışmaya dönüşen gerilim, piyasalarda “kara kuğu” etkisi yarattı. Güvenli liman talebiyle ons altın 53 yıl sonra 7 ay üst üste yükselirken, gram altın 8 bin TL sınırını aştı.","USA and Israel attacked Iran, a record of 53 years has been reached! Here are the prices. The tension that turned into a hot conflict between the USA and Iran created a ""black swan"" effect in the markets. Ounce of gold rose for 7 consecutive months after 53 years due to safe haven demand, while gram gold exceeded the 8 thousand TL limit.","USA et Israel Iraniam oppugnaverunt, testimonium 53 annorum perventum est! Hic sunt pretia. Contentio quae in calidum certamen vertitur inter USA et Iran ""olorem nigrum"" effectum in mercatis creavit. Uncia auri rosae per 7 menses continuos post 53 annos debitum ad portum tutum peregit, cum gram auri 8 mille turonensium modum excederet.",https://ekonomi.haber7.com/ekonomi/haber/3608285-abd-ve-israil-irana-saldirdi-altinda-53-yilin-rekoru-geldi-iste-fiyatlar,https://i20.haber7.net/resize/1280x720//haber/haber7/photos/2026/09/abd_israil_irana_saldirdi_altin_fiyatlari_rekor_kirdi_iste_fiyatlar_1772353033_1035.jpg,,"Orta Dou'da ABD ve ran arasnda bir süredir devam eden jeopolitik gerilimlerin yerini scak çatmaya brakmas, küresel finans piyasalarnda ""kara kuu"" etkisi yaratt. ABD ve srail'in ran'a yönelik gerçekle… [+2664 chars]",,2026-03-13 03:16:33+00:00,random,,,
9fe5bfa71fcd9b622316f813b5c7afd7,2026-03-06T11:38:23Z,Snow&Ice,don,www.chip.com.tr,tr,0.9,"Unaufhaltsamer Marsch bei minus 47 Grad: Er blieb nicht dort stehen, wo Menschen froren. In der klirrenden Kälte, in der selbst Smartphones innerhalb von Sekunden abschalteten, schrieb der Roboter G1, so groß wie ein achtjähriges Kind, Geschichte. Dieser kleine Riese, der unter den eisigen Bedingungen des Altai-Gebirges 130.000 Schritte zurücklegte, nutzte den Schnee, was er unter rauen natürlichen Bedingungen tun konnte.",Eksi 47 derecede durdurulamaz yürüyüş: İnsanın donduğu yerde o durmadı,"Akıllı telefonların bile saniyeler içinde kapandığı dondurucu soğukta, sekiz yaşında bir çocuk boyundaki robot G1 tarih yazdı. Altay dağlarının dondurucu şartlarında 130 bin adım atan bu küçük dev, zorlu doğa koşullarında neler yapabileceğini kar üzerine çizd…","Unstoppable march at minus 47 degrees: He did not stop where people froze. In the freezing cold, where even smartphones shut down within seconds, robot G1, the size of an eight-year-old child, made history. This little giant, who took 130 thousand steps in the freezing conditions of the Altai Mountains, drew on the snow what he could do in harsh natural conditions.","Nara itineris ad minus 47 gradus: Non cessavit ubi homines concreverunt. In frigore frigido, ubi etiam Suspendisse potenti intra secunda inclusi sunt, robot G1, magnitudo pueri octo annorum, historia fecit. Hic homunculus gigas, qui CXXX milia passum in congelatione montium Altai Montium sumpsit, nivibus signuni, quod in duris condicionibus naturalibus facere potuit.",https://www.chip.com.tr/guncel/eksi-47-derecede-durdurulamaz-yuruyus-insanin-dondugu-yerde-o-durmadi_178304.html,https://img.chip.com.tr/rcman/Cw1280h720q95gm/storage/files/images/2026/03/05/eksi-47-derecede-durdurulamaz-yuruyus-insanin-dondugu-yerde-o-durmadi-hibg.jpg,,"Yıllardır bilimkurgu filmlerinde, dizilerde ve çizgi romanlarda robotların dünyayı ele geçirişini ya da hayatımızı kolaylaştıran sadık dostlara dönüşünü izledik. Doctor Who’nun ürkütücü Daleklerinden… [+2919 chars]",,2026-03-13 03:16:33+00:00,random,,,
6fadd4893440fbdce7b897ba1830a07a,2026-03-08T04:00:00Z,Cold Wave,en soğuk yıl,www.hurriyet.com.tr,tr,0.7,"Von Kühlräumen bis zur Spitze der Wissenschaft. Fakultät für Naturwissenschaften der Universität Istanbul, Fakultät für Physik, Dozentin Prof. Dr. Fatma Aydoğmuş Şens Bildungsleben begann mit großen Schwierigkeiten. Als er 6 Jahre alt war, brannte ihr Haus nieder. Er lebte 2 Jahre lang in einem kleinen Zimmer seines Nachbarn. Als sie nach Hause zurückkehrten, waren die Türen noch nicht eingebaut. Prof. Dr. Ş…",Soğuk odalardan bilimin zirvesine,İstanbul Üniversitesi Fen Fakültesi Fizik Bölümü Öğretim Üyesi Prof. Dr. Fatma Aydoğmuş Şen’in eğitim hayatı büyük zorluklarla başladı. 6 yaşındayken evleri yandı. 2 yıl komşusunun küçük bir odasında yaşadı. Eve döndüklerinde kapılar takılmamıştı. Prof. Dr. Ş…,"From cold rooms to the top of science. Istanbul University Faculty of Science Physics Department Lecturer Prof. Dr. Fatma Aydoğmuş Şen's education life started with great difficulties. When he was 6 years old, their house burned down. He lived in a small room of his neighbor for 2 years. When they returned home, the doors were not installed. Prof. Dr. Ş…","A frigidis mansionibus usque ad culmen scientiae. Istanbul Universitas Facultatis Scientiae Physicae Department Lector Prof. Dr. Fatma Aydoğmuş en vitam educationem magnis difficultatibus incepit. Cum esset annorum VI, domus eorum incensa est. Vixit in parva camera proximi sui per 2 annos. Cum domum redierunt, fores non sunt constitutae. Prof. Dr. …",https://www.hurriyet.com.tr/gundem/soguk-odalardan-bilimin-zirvesine-43123801,https://image.hurimg.com/i/hurriyet/90/0x0/69ac9319a802d8e34762525b.jpg,,"p&gt;STANBUL Eminönünde doup büyüyen Prof. Dr. Fatma Aydomu en (43), ilkokula balayaca dönem çkan bir yangn nedeniyle ailesiyle birlikte yaad evin kül olmasna ahit oldu. Bu nedenle 2 yl boyunca komul… [+3043 chars]",,2026-03-13 11:07:42+00:00,random,,,
f64e1a0bc0246b447eb65f5185858a7d,2026-03-02T07:42:53Z,Cold Wave,soğuk büyü,www.yenicaggazetesi.com,tr,0.8,"Kalte Baklava-Brise in traditionellen Desserts. Der türkische Süß- und Backwarenmarkt hat in den letzten Jahren einen großen Wandel erlebt, bei dem traditionelle Rezepte mit modernen Akzenten neu interpretiert werden. Die Verlagerung der Verbraucherpräferenzen hin zu leichten Desserts und Milchdesserts hat die Wachstumsdynamik der Branche jährlich um 14 Prozent beschleunigt.",Geleneksel tatlılarda soğuk baklava rüzgarı,"Türkiye tatlı ve unlu mamuller pazarı, son yıllarda geleneksel tariflerin modern dokunuşlarla yeniden yorumlanmasıyla büyük bir değişim sürecine girmektedir. Tüketici tercihlerinin hafif ve sütlü tatlılara kayması, sektördeki büyüme ivmesini yıllık yüzde 14 b…","Cold baklava breeze in traditional desserts. The Turkish sweet and baked goods market has been undergoing a major change in recent years, with traditional recipes being reinterpreted with modern touches. The shift in consumer preferences towards light and milk desserts has accelerated the growth momentum in the sector by 14 percent annually.","Frigida baklava aura in demeritis traditis. Turcorum bona et cocta mercatus maiorem mutationem proximis annis subeunda sunt, cum receptaculis traditis cum recentibus tactibus reinterpretatur. Mutatio in optionibus consumptis ad demerita lucis et lactis incrementum acceleravit momentum in provincia per 14 centesimas annuatim.",https://www.yenicaggazetesi.com/geleneksel-tatlilarda-soguk-baklava-ruzgari-1005301h.htm,https://img.yenicaggazetesi.com/rcman/Cw1280h720q95gc/storage/files/images/2026/03/02/geleneksel-tatlilarda-soguk-baklava-ruzgari-49ac.jpg,,"Gastronomi dünyasındaki bu hareketlilik, yerel lezzetlerin küresel birer ekonomik değer haline gelmesine zemin hazırlamaktadır. Özellikle genç kuşağın talepleriyle şekillenen yeni pazar dengeleri, ma… [+5104 chars]",,2026-03-13 11:07:42+00:00,random,,,
39c96ac74092c984708236b6cfa597a7,2026-03-01T05:29:24Z,Heat Wave,ısı,www.yenicaggazetesi.com,tr,0.9,"Wer ist Ayatollah Ali Khamenei? Hier ist seine Lebensgeschichte und was während seiner Herrschaft geschah. Ayatollah Ali Khamenei, der bei den Angriffen der USA und Israels sein Leben verlor, erlebte während seiner Amtszeit wichtige Wendemomente für sein Land und den Nahen Osten. Hier ist, was Khamenei von seiner Geburt bis zu seiner Machtübernahme erlebte …",Ayetullah Ali Hamaney kimdir? İşte hayat hikayesi ve iktidarında yaşananlar,"ABD ve İsrail’in saldırısında hayatını kaybeden Ayetullah Ali Hamaney, iktidarda olduğu dönemde hem ülkesinin hem de Orta Doğu’nun önemli kırılma anlarına şahit oldu. İşte Hamaney’in doğumundan iktidara gelişine kadar yaşadıkları…","Who is Ayatollah Ali Khamenei? Here is his life story and what happened during his rule. Ayatollah Ali Khamenei, who lost his life in the attack of the USA and Israel, witnessed important breaking moments for both his country and the Middle East during his time in power. Here is what Khamenei experienced from his birth to his coming to power…","Quis est Ayatollah Ali Khamenei? Hic est eius vita narratio et quae in imperio eius gesta sunt. Ayatollah Ali Khamenei, qui in oppugnatione USA et Israel vitam amisit, momenta fractionis momenti testificati sunt pro patria et Medio Oriente suo tempore in potestate. Hinc est quod Khamenei periti a nativitate ad potentiam suam venientem.",https://www.yenicaggazetesi.com/ayetullah-ali-hamaney-kimdir-iste-hayat-hikayesi-ve-iktidarinda-yasananlar-1005039h.htm,https://img.yenicaggazetesi.com/rcman/Cw1280h720q95gc/storage/files/images/2026/03/01/ayetullah-ali-hamaney-kimdir-iste-hayat-hikayesi-ve-iktidarinda-yasananlar-2xul.jpg,,"İran Dini Lideri Ayetullah Ali Hamaney, ABD ve İsrail’in saldırılarında öldürüldü. İran Devlet Televizyonu, Hamane’yin cumartesi sabah erken saatlerde hayatını kaybettiğini duyurdu.
Hamaney, İran’ın… [+4470 chars]",,2026-03-13 11:07:42+00:00,random,,,
b2ab284278ffd81131683bc0914746d9,2026-03-11T17:59:55Z,Heat Wave,ısı,www.yenicaggazetesi.com,tr,0.9,"Kundgebung „Die Nation behauptet ihren Willen“ in Pendik: Zehntausende sind auf dem Platz. Die 97. Kundgebung „Nation bleibt ihrem Willen treu“, die von CHP für den inhaftierten Präsidenten der Stadtverwaltung von Istanbul und Präsidentschaftskandidaten Ekrem İmamoğlu initiiert wurde, fand in Pendik, Istanbul, statt. Zehntausende Menschen, die an der Kundgebung teilnahmen, forderten die Freilassung von İmamoğlu und vorgezogene Neuwahlen.",Pendik’te “Millet İradesine Sahip Çıkıyor” mitingi: On binler meydanda,CHP’nin tutuklu İBB Başkanı ve cumhurbaşkanı adayı Ekrem İmamoğlu için başlattığı “Millet İradesine Sahip Çıkıyor” mitinglerinin 97’ncisi İstanbul Pendik’te düzenlendi. Mitinge katılan on binlerce kişi İmamoğlu’nun serbest bırakılması ve erken seçim çağrısınd…,"“The Nation Claims Its Will” rally in Pendik: Tens of thousands are in the square. The 97th of the ""Nation Stands Up to Its Will"" rallies, initiated by CHP for the detained Istanbul Metropolitan Municipality President and presidential candidate Ekrem İmamoğlu, was held in Pendik, Istanbul. Tens of thousands of people attending the rally called for the release of İmamoğlu and early elections.","“Gens suam vindicat voluntatem” concursum in Pendik: Decem milia in quadrato sunt. 97th ""Nationis suae voluntati"" coit, a CHP initiatus est pro retenti Istanbul Metropolitanae Municipitatis Praeses et Praeses Ekrem İmamoğlu candidatus praesidentialis, habita in Pendik, Istanbul. Decem milia hominum concursum facientium emissionem mamoğlu et comitiorum veterum vocavit.",https://www.yenicaggazetesi.com/pendikte-millet-iradesine-sahip-cikiyor-mitingi-on-binler-meydanda-1008243h.htm,https://img.yenicaggazetesi.com/rcman/Cw1280h720q95gc/storage/files/images/2026/03/11/pendikte-millet-iradesine-sahip-cikiyor-mitingi-on-binler-meydanda-wtto.jpg,,"CHP’nin tutuklu İstanbul Büyükşehir Belediye Başkanı ve cumhurbaşkanı adayı Ekrem İmamoğlu için başlattığı “Millet İradesine Sahip Çıkıyor” mitingleri devam ediyor.
Bu kapsamda düzenlenen mitingleri… [+11959 chars]",,2026-03-13 11:07:42+00:00,random,,,
16a44a74d36022829966e946e9042e8d,2026-03-12T11:36:00Z,Heat Wave,en sıcak yaz,www.haber7.com,tr,0.9,"Die Welt wird verbrennen ... Der stärkste El Nino der Geschichte steht vor der Tür! Welche Auswirkungen wird es auf Türkiye haben? Ein starker Super El Niño, der im Pazifik auftreten könnte, könnte das Klimagleichgewicht auf der ganzen Welt verändern. Experten zufolge besteht in der Türkei vor allem in den Sommermonaten die Möglichkeit erhöhter Temperaturen, Dürre und erhöhter Waldbrandgefahr.",Dünya kavrulacak... Tarihin en güçlü El Nino’su kapıda! Türkiye'yi nasıl etkileyecek?,"Pasifik’te oluşabilecek güçlü bir Süper El Nino, dünya genelinde iklim dengelerini değiştirebilir. Uzmanlara göre Türkiye’de ise özellikle yaz aylarında sıcaklık artışı, kuraklık ve orman yangını riskinin yükselmesi ihtimali bulunuyor.","The world will be scorched... The strongest El Nino in history is at the door! How will it affect Türkiye? A strong Super El Niño that may occur in the Pacific could change climate balances around the world. According to experts, there is a possibility of temperature increases, drought and increased risk of forest fires in Türkiye, especially in the summer months.","Mundus ambustabitur... Fortissimum El Nino in historia ostium est! Quomodo afficiet Türkiye? Fortis Super El Niño, quae in Pacifico fieri potest, stateras climatis circa mundum mutare potuit. Secundum peritos, possibilitas temperaturae augetur, siccitas et periculum incendium silvarum in Türkiye, praesertim mensibus aestivis, augetur.",https://www.haber7.com/guncel/haber/3611414-dunya-kavrulacak-tarihin-en-guclu-el-ninosu-kapida-turkiyeyi-nasil-etkileyecek,https://i20.haber7.net/resize/1280x720//haber/haber7/photos/2026/11/dunya_kavrulacak_tarihin_en_guclu_el_ninosu_kapida_turkiyeyi_nasil_etkileyecek_1773315345_6957.jpg,,"Avrupa Orta Vadeli Hava Tahmin Merkezi (ECMWF) tarafndan açklanan iklim modelleri, bu yln sonlarna doru Pasifik Okyanusunda srad güçlü bir El Nino geliebileceini gösteriyor.
Ekvatoral bölgede batdan… [+2859 chars]",,2026-03-14 03:15:04+00:00,random,,,
3249a4f1ac83648536418192744c9449,2026-03-13T02:58:00Z,Earthquake,deprem,www.haber7.com,tr,0.9,"Aktuelle Nachrichten: Nachrichten kamen aus einer unserer Provinzen! Nach dem Vorfall wurden die Schulen geschlossen.... Aktuelle Nachrichten... Der Unterricht wurde nach dem Erdbeben in Tokat eingestellt. Der Provinzdirektor für nationale Bildung, Hüseyin Kır, gab bekannt, dass die Schulen in den Bezirken Niksar, Erbaa, Başçiftlik und Reşadiye aus Vorsichtsgründen geschlossen seien.",Son dakika: 1 ilimizden haber geldi! Yaşanan olay sonrası okullar tatil edildi...,"Son dakika... Tokat'ta meydana gelen deprem sonrası eğitime ara verildi. İl Milli Eğitim Müdürü Hüseyin Kır, Niksar, Erbaa, Başçiftlik ve Reşadiye ilçelerinde okulların tedbir amaçlı tatil edildiğini duyurdu.","Breaking news: News came from 1 of our provinces! Schools were closed after the incident.... Breaking news... Education was suspended after the earthquake in Tokat. Provincial Director of National Education Hüseyin Kır announced that schools in Niksar, Erbaa, Başçiftlik and Reşadiye districts were closed for precautionary purposes.","News: Nuntii ex 1 nostris provinciis venerunt! Scholae clausae sunt post incident. Director provincialis Nationalis Educationis Hüseyin Kır nuntiavit scholas in Niksar, Erbaa, Başçiftlik et Reşadiye regiones ad cautelas proposita clausas esse.",https://www.haber7.com/guncel/haber/3611560-son-dakika-1-ilimizden-haber-geldi-yasanan-olay-sonrasi-okullar-tatil-edildi,https://i20.haber7.net/resize/1280x720/haber/haber7/bigmanset/2026/11/son_dakika_1_ilimizden_haber_geldi_yasanan_olay_sonrasi_okullar_tatil_edildi_1773370837_339.gif,,"Son dakikahaberi... Gece yars Tokat'ta meydana gelen 5,5 büyüklüündeki deprem yürekleri aza getirdi. Bölgede hasar tespit çalmalar sürerken artç depremler de pe pee oldu. uan için herhangi bir olumsu… [+1224 chars]",,2026-03-14 15:53:53+00:00,random,,,
