index,published,topic,term,domain,language,valid,de,title,description,en,la,url,image,archive,content,quote,added,feed,country,ipcc,continent
a3d6bd89fc234ddca88b3347a49470e9,2026-03-05T00:15:44Z,Storm,fırtına,www.odatv.com,tr,0.9,"Der Schneesturm verursachte einen schrecklichen Unfall. Zwei Lastwagen kollidierten frontal, da die Sicht aufgrund des starken Schneefalls und des Sturms im Bezirk Karayazı in Erzurum eingeschränkt war. 1 Fahrer kam bei dem Unfall ums Leben.",Tipi feci kazaya neden oldu,Erzurum’un Karayazı ilçesinde etkili olan yoğun kar yağışı ve fırtına nedeniyle görüş mesafesinin düşmesi sonucu iki kamyon kafa kafaya çarpıştı. Kazada 1 sürücü hayatını kaybetti.,The blizzard caused a terrible accident. Two trucks collided head-on as a result of reduced visibility due to heavy snowfall and storm in Erzurum's Karayazı district. 1 driver died in the accident.,Blizzard casus atrox effecit. Duae aliquet in capite colliduntur propter visibilem reductam propter nix gravis et procellae in regione Karayaz Erzuri. 1 agitator casu mortuus est.,https://www.odatv.com/guncel/tipi-feci-kazaya-neden-oldu-120138264,https://img.odatv.com/rcman/Cw1280h720q95gc/storage/files/images/2026/03/05/tipi-feci-kazaya-neden-oldu-71te.jpg,,"Kaza, Erzurum'un Karayaz ilçesinde iki kamyon sürücüsünün kafa kafaya çarpmas sonucu meydana geldi. Kazann ardndan olay yerine itfaiye ekipleri, kepçe operatörü, salk ekipleri ve olay yeri inceleme e… [+291 chars]",,2026-03-22 06:29:44+00:00,random,,,
331d2fe0b26ae63dff1b88bcdc618756,2026-03-09T04:57:00Z,Storm,fırtına,www.yenicaggazetesi.com,tr,0.9,Der „perfekte Sturm“ steht für die türkische Wirtschaft vor der Tür: Naki Bakır erläuterte die geheime Bilanz des Öls. Brent-Öl stieg um 25 Prozent und erreichte 119 Dollar. Naki Bakır erläuterte anhand von Daten nacheinander die wirtschaftliche Auswirkung der Ölpreise auf die Türkei.,Türkiye ekonomisi için ‘kusursuz fırtına’ kapıda: Petrolün gizli bilançosunu Naki Bakır anlattı,"Brent petrol yüzde 25’lik bir yükseliş gerçekleştirerek 119 dolar seviyelerine kadar çıktı. Naki Bakır, verilerle petrol fiyatlarının Türkiye’ye ekonomik yansımasını tek tek anlattı.",The 'perfect storm' is at the door for the Turkish economy: Naki Bakır explained the secret balance sheet of oil. Brent oil increased by 25 percent and reached 119 dollars. Naki Bakır explained the economic reflection of oil prices on Turkey one by one with data.,"""Tempestas perfecta"" est in porta oeconomiae Turcicae: Naki Bakır explicavit stateram secretam olei. Oleum Brent auctum 25 centesimis et 119 dollariis attigit. Naki Bakır explicavit reflexionem oeconomicam pretiis olei in Turcia singillatim data.",https://www.yenicaggazetesi.com/turkiye-ekonomisi-icin-kusursuz-firtina-kapida-petrolun-gizli-bilancosunu-naki-bakir-anlatti-1007289h.htm,https://img.yenicaggazetesi.com/rcman/Cw1280h720q95gc/storage/files/images/2026/03/09/turkiye-ekonomisi-icin-kusursuz-firtina-kapida-petrolun-gizli-bilancosunu-naki-bakir-anlatti-d3ox.jpg,,"ABD ve ran arasndaki sava gerilimi en çok Brent petrol fiyatlarn etkiledi. Öyle ki gece yars ran, yeni liderinin Hamaneyin olu Mücteba Hamaney olarak açklamasnn ardndan Brent petrol yüzde 25lik bir y… [+2032 chars]",,2026-03-22 06:29:44+00:00,random,,,
06786264baef8fba9de96b89805995c7,2026-03-01T21:01:00Z,Storm,fırtına,www.yenicaggazetesi.com,tr,0.7,Der perfekte Sturm der Weltwirtschaft…. Selçuk GEÇER schrieb: Der perfekte Sturm der Weltwirtschaft…,Küresel Ekonominin Kusursuz Fırtınası…,Selçuk GEÇER yazdı: Küresel Ekonominin Kusursuz Fırtınası…,The Perfect Storm of the Global Economy…. Selçuk GEÇER wrote: The Perfect Storm of the Global Economy…,Procellae perfectae globalis oeconomiae…. Selçuk GEÇER scripsit: Tempestas perfecta globalis oeconomiae…,https://www.yenicaggazetesi.com/kuresel-ekonominin-kusursuz-firtinasi-1005208h.htm,https://img.yenicaggazetesi.com/rcman/Cw1280h720q95gc/storage/files/images/2026/03/01/kuresel-ekonominin-kusursuz-firtinasi-pnkn.jpg,,"Gizli ABD Çin Savaşı… Petrol 150 Altın 10 bin Dolar Hikayesi...
Dünya ekonomisi uzun süredir kırılgan bir dengede ilerliyor. Büyüme var ama istikrarsız; enflasyon düşüyor deniyor ama kalıcı değil; b… [+4616 chars]",,2026-03-22 10:56:52+00:00,random,,,
c7709931c797560b5b00fd1bf0c3add3,2026-03-09T06:00:00Z,Thunderstorm,fırtına,spor.haber7.com,tr,0.7,Storm ist für 3 Punkte auf dem Feld! Hier sind die möglichen Startelf des Spiels Kayserispor-Trabzonspor.... Kayserispor und Trabzonspor werden heute Abend in der 25. Woche der Trendyol Super League gegeneinander antreten. Stunden vor diesem Spiel wurden die möglichen Startelf beider Teams bekannt gegeben.,Fırtına 3 puan için sahada! İşte Kayserispor-Trabzonspor maçının muhtemel ilk 11'leri...,"Trendyol Süper Lig'in 25. haftasında Kayserispor ile Trabzonspor, bu akşam karşı karşıya gelecekler. Bu mücadeleye saatler kala her iki takımın da muhtemel ilk 11'leri belli oldu.","Storm is on the field for 3 points! Here are the possible starting 11s of the Kayserispor-Trabzonspor match.... Kayserispor and Trabzonspor will face each other this evening in the 25th week of the Trendyol Super League. Hours before this match, the possible starting 11s of both teams were announced.",Tempestas in campo est 3 puncta! Hic possibilis initium 11s par Kayserispor-Trabzonspor.... Kayserispor et Trabzonspor inter se occurrent hac vespera in 25 hebdomade Trendyol Super League. Horae ante hanc copulam possibilis initium 11 utriusque iugis nuntiata est.,https://spor.haber7.com/super-lig/haber/3610440-firtina-3-puan-icin-sahada-iste-kayserispor-trabzonspor-macinin-muhtemel-ilk-11leri,https://i20.haber7.net/resize/1280x720//haber/haber7/photos/2026/11/firtina_3_puan_icin_sahada_iste_kayserispor_trabzonspor_macinin_muhtemel_ilk_11leri_1773036168_8958.jpg,,"Trendyol Süper Lig'in 25. haftasnda zirve takibini sürdüren Trabzonspor, Kayserispor ile deplasmanda kar karya gelecek.
RHG Enertürk Enerji Stadyumu'nda oynanacak maç saat 20.00'de balayacak. Karlam… [+1183 chars]",,2026-03-22 10:56:52+00:00,random,,,
2a973a8803c3c3f85a2558941ff6732a,2026-03-17T18:50:03Z,Flood,ani sel,www.chip.com.tr,tr,0.8,"„Abo“-Schlag für digitale Plattformen: Warum kehren DVDs und Schallplatten zurück? Die in die Technologie hineingeborene Generation Z hat die endlosen Preise für Internetübertragungen und das plötzliche Verschwinden von Inhalten satt. Hier sind die wirtschaftlichen und psychologischen Gründe für diese überraschende Rückkehr junger Menschen, die die digitale Welt verlassen und in physisches Eigentum Zuflucht gesucht haben.","Dijital platformlara ""abonelik"" darbesi: DVD ve plaklar neden geri dönüyor?","Teknolojinin içine doğan Z kuşağı, internet yayıncılığının bitmek bilmeyen zamlarından ve içeriklerin aniden kaybolmasından sıkıldı. İşte, dijital dünyayı terk edip fiziksel mülkiyete sığınan gençlerin bu şaşırtıcı dönüşünün arkasındaki ekonomik ve psikolojik…","""Subscription"" blow to digital platforms: Why are DVDs and records coming back? Generation Z, born into technology, is tired of the endless prices of internet broadcasting and the sudden disappearance of content. Here are the economic and psychological reasons behind this surprising return of young people who abandoned the digital world and took refuge in physical property.","""Subscription"" ictu ad tabulata digitalis: Cur DVDs et monumenta redeunt? Generatio Z, technologia in technologia nata, taedet pretia infinita interretiorum evulgationis et contenti subita ablatione. Hic rationes oeconomicae et psychologicae sunt post tam mirabilem reditum iuvenum, qui mundum digitalem reliquerunt et in bona corporalia refugerunt.",https://www.chip.com.tr/guncel/dijital-platformlara-abonelik-darbesi-dvd-ve-plaklar-neden-geri-donuyor_178640.html,https://img.chip.com.tr/rcman/Cw1280h720q95gm/storage/files/images/2026/03/16/z-kusagi-abonelik-yorgunluguna-karsi-fiziksel-medyayi-seciyor-71nm.jpg,,"Dijital yayın platformlarının medya dünyasındaki mutlak hakimiyeti, beklenmedik bir dirençle karşılaşmaya başladı. İnternet üzerinden dizi, film ve müzik tüketiminin zirve yaptığı bir dönemde, teknol… [+2986 chars]",,2026-03-22 15:53:25+00:00,random,,,
d5e476bcaf701790663f049636e8ac56,2026-03-01T16:01:27Z,Heat Wave,ısı,www.patronlardunyasi.com,tr,0.9,"Was wird die neue Adresse des globalen Kapitals im Kriegsumfeld sein? Warum ist Türkiye wirtschaftlich und politisch sicher? Der Glanz Dubais verdeckte die Realität des Nahen Ostens. Die Raketen haben diesen Vorhang zerrissen. Ich habe versucht, dies in meinem vorherigen Artikel zu erklären. Jetzt möchte ich mit Ihnen ein Brainstorming durchführen. Ich habe drei Fragen. Erstens ist das globale Kapital nach dieser Situation in Dubai an diesem Punkt angelangt …","Savaş ortamında küresel sermayenin yeni adresi neresi olacak, Türkiye ekonomik ve siyasi açıdan neden güvenli","Dubai'nin ışıltısı Ortadoğu gerçeğini perdelemişti. Füzeler o perdeyi yırttı. Bir önceki yazımda bunu anlatmaya çalışmıştım. Şimdi sizlerle bir beyin fırtınası yapayım istiyorum. Üç sorum var. İlki, Dubai'de oluşan bu durumdan sonra küresel sermaye bu noktada…","What will be the new address of global capital in the war environment? Why is Türkiye economically and politically safe? The glitter of Dubai obscured the reality of the Middle East. The missiles tore that curtain. I tried to explain this in my previous article. Now I want to brainstorm with you. I have three questions. Firstly, after this situation in Dubai, global capital is at this point…","Quae inscriptio nova capitis globalis in ambitu belli erit? Cur Türkiye oeconomice et politice tuta est? Fulgor Dubai rem Medi Orientis obscuravit. Tela sagum scindebant. Hoc explicare conatus sum in superiori articulo. Nunc Interitus volo tecum. Quaestiones tres habeo. Uno modo, post hanc condicionem in Dubai, caput global hoc loco…",https://www.patronlardunyasi.com/savas-ortaminda-kuresel-sermayenin-yeni-adresi-neresi-olacak-turkiye-ekonomik-ve-siyasi-acidan-neden-guvenli,https://i.pdimage.com/static/content/26-03/01/ortadogu-dubai.png,,"Toygun ATLLA
KÜRESEL SERMAYE KNC ADRES ARAMAYA BALAR
Sonda söyleyeceimi en batan söyleyerek balayaym. Sermaye, Dubai'den hemen kaçmaz. Ancak, kinci adresini aramaya balar. Ki bence u anda Dubai'de … [+4069 chars]",,2026-03-22 15:53:25+00:00,random,,,
dd13d08bd151a6f3887cb00ac9a23259,2026-03-08T13:29:00Z,Storm,fırtına,spor.haber7.com,tr,0.9,"Bursaspor stürmt in der 2. Liga! Sie haben sich die Führung im „Feld“ gesichert: Die Schere öffnet sich. Bursaspor, das in der TFF 2. Liga um die Meisterschaft kämpfte, besiegte Muşspor auswärts mit 1:0 durch das Tor von İlhan Depe.",2. Lig'de Bursaspor fırtınası! 'Tarla'da liderlik perçinlediler: Makas açılıyor,"TFF 2. Lig’de şampiyonluk mücadelesi veren Bursaspor, deplasmanda Muşspor’u İlhan Depe’nin golüyle 1-0 mağlup etti.","Bursaspor storm in the 2nd League! They clinched the leadership in the 'Field': The scissors are opening. Bursaspor, struggling for the championship in the TFF 2nd League, defeated Muşspor 1-0 away with the goal of İlhan Depe.","Bursaspor tempestas in foedere 2! Ductum in 'Agro': forcipe aperiunt. Bursaspor, pro patrocinio in TFF 2nd Foederis luctans, Muşspor 1-0 cum meta İlhan Depe superavit.",https://spor.haber7.com/ikinci-lig/haber/3610347-2-ligde-bursaspor-firtinasi-tarlada-liderlik-percinlediler-makas-aciliyor,https://i20.haber7.net/resize/1280x720//haber/haber7/photos/2026/10/2_ligde_bursaspor_firtinasi_makasi_giderek_aciyorlar_1772976411_4165.jpg,,"Bursaspor, TFF 2. Lig 27. hafta müsabakasnda deplasmanda Muspor ile kar karya geldi.
Mu ehir Stadnda oynanan ve kötü saha zemini ile futbolcularn zaman zaman ayakta kalmakta zorland mücadelede ev sa… [+427 chars]",,2026-03-22 15:53:25+00:00,random,,,
c38363955359dc429e853317bdad4697,2026-03-18T21:02:00Z,Storm,fırtına,www.hurriyet.com.tr,tr,0.9,"Galatasarays Uğurcan Çakır wuchs in seinem Schloss auf: Für die Tournee in England reichten seine Bemühungen nicht! Obwohl Galatasaray im schwierigen Liverpool-Auswärtsspiel mit 0:4 verlor und sich aus Europa verabschiedete, stürmte Uğurcan Çakır das Feld. Der Einsatz des Nationalspielers, der insgesamt neun klare Paraden erzielte, darunter den Elfmeter von Mohamed Salah, reichte für die Tour in England nicht aus.","Galatasaray'da Uğurcan Çakır, kalesinde büyüdü: Çabası İngiltere'de tur için yetmedi!","Galatasaray, zorlu Liverpool deplasmanından 4-0 mağlup ayrılarak Avrupa'ya veda etmesine rağmen sahada adeta bir Uğurcan Çakır fırtınası esti. Mohamed Salah'ın penaltısı dahil toplam 9 net kurtarışa imza atan milli eldivenin çabası İngiltere'de tur için yetme…","Galatasaray's Uğurcan Çakır grew up in his castle: His efforts were not enough for the tour in England! Although Galatasaray lost 4-0 in the difficult Liverpool away game and bid farewell to Europe, Uğurcan Çakır stormed the field. The effort of the national glove, who made a total of 9 clear saves, including Mohamed Salah's penalty, was not enough for the tour in England.","Galatasaray's Uğurcan Çakır in castro suo crevit: Eius conatus non sufficiunt ad Peregrinationem in Anglia! Quamquam Galatasaray 4-0 in difficili Liverpool ludum amisit et ad Europam valere iussit, Uğurcan Çakır campum expugnavit. Conatus chirothecae nationalis, qui totalem 9 servatos claros fecit, etiam poenam Mohamed Salah, in Anglia viae non satis fuit.",https://www.hurriyet.com.tr/sporarena/galatasarayda-ugurcan-cakir-kalesinde-buyudu-cabasi-ingilterede-tur-icin-yetmedi-43131875,https://image.hurimg.com/i/hurriyet/90/0x0/69bb212c5b06fcb7fa322a34.jpg,,"p&gt;Galatasaray, konuk olduu Liverpool deplasmanndan 4-0 malup ayrlarak UEFA ampiyonlar Ligi'ne veda etti. Maça ise kaleci Uurcan Çakr'n muhteem performans damga vurdu.SZOBOSZLAI'YE ENGEL OLAMADIK
… [+1944 chars]",,2026-03-22 15:53:25+00:00,random,,,
ca713492ea24342ce5d7b309af7296a5,2026-03-18T21:02:02Z,Thunderstorm,fırtına,www.hurriyet.com.tr,tr,0.9,"Galatasarays Uğurcan Çakır wuchs in seinem Schloss auf: Er war der einzige Name, der in England in der ersten Halbzeit auffiel! Während Galatasaray in der ersten Halbzeit des schwierigen Liverpool-Auswärtsspiels mit 0:1 zurücklag, stürmte Uğurcan Çakır das Feld. Der Nationalspieler, der insgesamt 6 klare Paraden abwehrte, darunter den Elfmeter von Mohamed Salah, ist mit Abstand der prominenteste Name der ersten Halbzeit in England ...","Galatasaray'da Uğurcan Çakır, kalesinde büyüdü: İngiltere'de ilk yarıda ön plana çıkan tek isim oldu!","Galatasaray, zorlu Liverpool deplasmanında ilk yarıyı 1-0 geride kapatırken sahada adeta bir Uğurcan Çakır fırtınası esti. Mohamed Salah'ın penaltısı dahil toplam 6 net kurtarışa imza atan milli eldiven İngiltere'de ilk yarının açık ara en çok öne çıkan ismi …","Galatasaray's Uğurcan Çakır grew up in his castle: He was the only name that stood out in the first half in England!. While Galatasaray was trailing 1-0 in the first half of the difficult Liverpool away game, Uğurcan Çakır stormed the field. The national glove, who made a total of 6 clear saves, including Mohamed Salah's penalty, is by far the most prominent name of the first half in England...","Galatasaray's Uğurcan Çakır in arce sua crevit: id solum nomen est, quod in prima parte Angliae eminuit. Dum Galatasaray trahebat 1-0 in prima parte difficilis Liverpool ludum auferebat, Uğurcan Çakır campum expugnavit. Globus nationalis, qui summam VI clarum servat, incluso poenam Mahumetis Salah fecit, longe praestantissimum nomen primae dimidiae in Anglia est...",https://www.hurriyet.com.tr/sporarena/galatasarayda-ugurcan-cakir-kalesinde-buyudu-ingilterede-ilk-yarida-on-plana-cikan-tek-isim-oldu-43131875,https://image.hurimg.com/i/hurriyet/90/0x0/69bb0f445b06fcb7fa322a23.jpg,,"p&gt;Galatasaray, Avrupa mesaisinde konuk olduu Liverpool deplasmannda ilk 45 dakikay 1-0 malup tamamlarken, maça kaleci Uurcan Çakr'n muhteem performans damga vurdu.SZOBOSZLAI'YE ENGEL OLAMADIK
Kar… [+1703 chars]",,2026-03-22 15:53:25+00:00,random,,,
108fb9d4fea23e01c3c512db561c464b,2026-03-21T15:13:00Z,Storm,fırtına,spor.haber7.com,tr,0.9,Sivassspor stürmt in der 1. Liga! Yiğidos steht kurz vor den Play-offs. In der 32. Woche der Trendyol 1st League besiegte Özbelsan Sivasspor Manisa FK mit 1:0 und holte sich seinen 5. Sieg in den letzten 6 Spielen.,1. Lig'de Sivassspor fırtınası! Yiğidolar play-off'a yaklaştı,"Trendyol 1. Lig’in 32. haftasında Özbelsan Sivasspor, Manisa FK'yı 1-0 mağlup ederek son 6 maçta 5. galibiyetini aldı.","Sivassspor storm in the 1st League! Yiğidos are close to the play-offs. In the 32nd week of Trendyol 1st League, Özbelsan Sivasspor defeated Manisa FK 1-0 and got its 5th victory in the last 6 matches.","Sivassspor tempestas in 1st Achaici! Yiğidos prope fabulas peracti sunt. In 32 septimana Trendyoli 1 Foedus, Özbelsan Sivasspor Manisa FK 1-0 vicit et suam quintam victoriam in ultimis sex paribus obtinuit.",https://spor.haber7.com/birinci-lig/haber/3613848-1-ligde-sivassspor-firtinasi-yigidolar-play-offa-yaklasti,https://i20.haber7.net/resize/1280x720//haber/haber7/photos/2026/12/1_ligde_sivassspor_firtinasi_yigidolar_gozunu_paly_offa_yaklasti_1774105942_1832.jpg,,"Trendyol 1. Lig'in 32. haftasnda Manisa FK ile Özbelsan Sivasspor kar karya geldi.
Sivasspor 30. dakikada Jonathan Okoronkwo'nun att golle maç 1-0 kazand.
Sivasspor'da Bekir Böke 70. dakikada penal… [+264 chars]",,2026-03-22 15:53:25+00:00,random,,,
2055ac8cc98d7a246d2038b4f9e1da38,2026-03-20T05:19:57Z,Drought,kuraklık,www.odatv.com,tr,0.9,"Wie die Klimakrise die Zukunft der Tomaten verändert. Starke Regenfälle, Dürre und sich schnell ausbreitende Schädlinge... Während die offene Landwirtschaft immer fragiler wird, wird die Lösung in Gewächshäusern gesucht. Aber dieses Mal sind nicht nur Landwirte vor Ort – KI-gesteuerte Roboter sind bereit, die Zukunft der Ernte zu übernehmen.",İklim krizi domatesin geleceğini nasıl yeniden yazıyor,"Şiddetli yağmurlar, kuraklık ve hızla yayılan zararlılar… Açık tarım giderek kırılgan hale gelirken, çözüm seralarda aranıyor. Ancak bu kez sahnede yalnızca çiftçiler yok—yapay zeka destekli robotlar, hasadın geleceğini devralmaya hazırlanıyor.","How the climate crisis is rewriting the future of tomatoes. Heavy rains, drought and rapidly spreading pests... While open agriculture is becoming increasingly fragile, the solution is sought in greenhouses. But this time, farmers aren't the only ones on the scene—AI-powered robots are poised to take over the future of harvesting.","Discrimen climatis quomodo scribit futurum tomatoes. Imbres graves, siccitas et pestes rapide diffunduntur... Dum agri cultura magis magisque fragilis fit, solutio quaerenda est in greenhouses. Sed hoc tempore, agricolae non solum in scaena robots-AI-powered suspensae sunt ad futuram messem accipiendam.",https://www.odatv.com/gastroda/iklim-krizi-domatesin-gelecegini-nasil-yeniden-yaziyor-120140112,https://img.odatv.com/rcman/Cw1280h720q95gc/storage/files/images/2026/03/20/iklim-krizi-domatesin-gelecegini-nasil-yeniden-yaziyor-7fbv.jpg,,"Tarm, belki de insanlk tarihinin en eski üretim biçimi. Ancak bugün, doayla kurduu o kadim denge ciddi bir snavdan geçiyor. Ar yalar topra sürükleyip götürüyor; kuraklk bitkilerin köklerini daha topr… [+2301 chars]",,2026-03-23 16:32:14+00:00,random,,,
8638b675b8e5fc6807ce7ca95646fdb3,2026-03-16T10:09:00Z,Precipitation,sağanak yağmur Seyşeller,www.hurriyet.com.tr,tr,0.3,"Festliche Stimmung auf den Bildschirmen. Die schönsten Momente des Urlaubs, die uns in Erinnerung bleiben, sind die unbezahlbaren Stunden mit der Familie. Ein Film, der nach spannenden Gesprächen, herzlichem Lachen und überfüllten Tischen beginnt, sorgt für eine festliche Atmosphäre in den Häusern.",Ekranlarda bayram havası,"Bayramın hatıralarda kalan en güzel anları, ailece geçirilen paha biçilmez zamanlardır. Sürükleyici sohbetler, içten kahkahalar ve kalabalık sofraların ardından açılan bir film, evlerde bayram havası estirir.","Festive atmosphere on the screens. The best moments of the holiday that remain in our memories are the priceless times spent with the family. A movie that opens after engaging conversations, heartfelt laughter and crowded tables creates a festive atmosphere in homes.","Festivitates aeris in pluteis. Optima momenta feriarum quae in nostra memoria manent sunt tempora inaestimabilis apud familiam desumpta. Pellicula, quae post colloquia occupata aperit, risus cordis et mensae frequentes festivum atmosphaeram in domibus gignit.",https://www.hurriyet.com.tr/kelebek/televizyon/ekranlarda-bayram-havasi-43129874,https://image.hurimg.com/i/hurriyet/90/0x0/69b7d6bf2e1c5c3a88eb630a.jpg,,"p&gt;D-Smart GO, Ramazan Bayramnda izleyicileri kimi zaman nostaljik kimi zaman da elenceli bir sinema yolculuuna davet ediyor. 18 Martta platformun ana sayfasnda Bayram Havas kategorisi açlacak. Bu … [+2329 chars]",,2026-03-23 21:06:48+00:00,wmo,Seychelles,EIO,Africa
798caec0e8766d9c6143150fe52af081,2026-03-06T07:46:37Z,Thunderstorm,dolu,www.hurriyet.com.tr,tr,0.9,"Der Fledermausmann flog im Skigebiet Ergan Mountain. Der Basejumper (freier Fall) und Wingsuit-Athlet (Batman-Flug) Cengiz Koçak flog im Erzincan Ergan Mountain Ski Center. Für spannende Momente sorgte Koçak, der sich aus 500 Metern ins Leere warf.",Yarasa adam Ergan Dağı Kayak Merkezi'nde uçtu,"Base Jump (serbest düşüş) ve wingsuit (yarasa adam uçuşu) sporcusu Cengiz Koçak, Erzincan Ergan Dağı Kayak Merkezi'nde uçtu. 500 metreden kendini boşluğa bırakan Koçak, izleyenlere heyecan dolu anlar yaşattı.","The bat man flew in Ergan Mountain Ski Resort. Base Jump (free fall) and wingsuit (Batman flight) athlete Cengiz Koçak flew at Erzincan Ergan Mountain Ski Center. Koçak, who threw himself into the void from 500 meters, gave the audience exciting moments.","Vespertilio volavit in Ergan Mountain ski. Base Salire (fallis gratis) et alarum (Batman fuga) athleta Cengiz Koçak ad Erzincan Ergan Mountain Ski Centre volavit. Koçak, qui se in vacuum ex 500 metris proiecit, momenta excitandi auditoribus dedit.",https://www.hurriyet.com.tr/gundem/yarasa-adam-ergan-dagi-kayak-merkezinde-uctu-43122505,https://image.hurimg.com/i/hurriyet/90/0x0/69aa86234e44e2b5f13ed611.jpg,,"p&gt;Doa sporlarnn önemli merkezlerinden Erzincanda, kayak sporunun yan sra farkl ekstrem sporlar da yaplyor. Kent merkezine yaklak 12 kilometre uzaklktaki Ergan Da Kayak Merkezi, yerli ve yabanc kay… [+1255 chars]",,2026-03-23 21:06:48+00:00,random,,,
0732741e17e88e00e659ab131440d0fc,2026-03-15T04:00:00Z,Thunderstorm,dolu,www.hurriyet.com.tr,tr,0.9,"Aktivitätsführer von A bis Z… Für einen vollen Urlaub. Die Zwischenferien sind mit dem Ramadan-Fest verschmolzen, die 9-tägigen Feiertage haben begonnen ... Ein farbenfroher Aktivitätsführer für Schüler, die sowohl Urlaub als auch Ferien haben ...",A’dan Z’ye etkinlik rehberi… Dolu dolu bir tatil için,"Ara tatil Ramazan Bayramı’yla birleşti, 9 günlük tatil başladı… Hem tatil hem bayram yapacak olan öğrenciler için birbirinden renkli etkinlik rehberi…","Activity guide from A to Z… For a full holiday. Mid-term break has merged with Ramadan Feast, the 9-day holiday has begun... A colorful activity guide for students who will have both a holiday and a holiday...","Actio dux ab A ad Z… Ad plenam feriam. Medium tempus intermissum cum Ramadan Festo immiscuit, dies festus 9 dies incepit... Ductor vario actuum studentium qui tam ferias quam ferias habebunt...",https://www.hurriyet.com.tr/gundem/adan-zye-etkinlik-rehberi-dolu-dolu-bir-tatil-icin-43129013,https://image.hurimg.com/i/hurriyet/90/0x0/69b5f136fe458f6fc40391d5.jpg,,p&gt;YAKLAIK 18 milyon örenci ve 1 milyon 200 bin öretmen için ara tatil cuma günü balad. Milli Eitim Bakanl (MEB) takvimine göre bayramla birleen tatil resmi olarak 16-20 Mart tarihleri arasnda gerç… [+2594 chars],,2026-03-23 21:06:48+00:00,random,,,
224d3d0c74a31797427d1b307737ae4e,2026-03-15T04:00:00Z,Thunderstorm,dolu,www.hurriyet.com.tr,tr,0.9,"Ein Topf voller Schönheit. Die kleine „Beauty“-Bewegung von Ali Umut Usta, die Betontöpfe voller Zigarettenkippen reinigt und Pflanzen auf den Straßen Istanbuls pflanzt, erregt in den sozialen Medien Aufmerksamkeit.",Bir saksı güzellik,İstanbul’un sokaklarında izmarit dolu beton saksıları temizleyip bitki diken Ali Umut Usta’nın küçük ‘güzellik’ hareketi sosyal medyada ilgi görüyor.,"A pot of beauty. The small 'beauty' movement of Ali Umut Usta, who cleans concrete pots full of cigarette butts and plants plants on the streets of Istanbul, attracts attention on social media.","Olla pulchritudinis. Parva pulchritudinis motus Ali Umut Usta, qui concretas ollas cigarette butts et plantas in plateis Istanbul plenas purgat, attentionem in mediis socialibus attrahit.",https://www.hurriyet.com.tr/kelebek/hurriyet-pazar/bir-saksi-guzellik-43128735,https://image.hurimg.com/i/hurriyet/90/0x0/69b55c99fe458f6fc4038e7d.jpg,,"p&gt;Sosyal medyadaki ltl hayatlar, kusursuz kareler artk eskisi kadar etki yaratmyor.  Günün sonunda aklmzda kalan, filtrelerle süslenmi deil, ruhumuzu doyuran paylamlar oluyor. stanbulun farkl köel… [+2808 chars]",,2026-03-23 21:06:48+00:00,random,,,
