index,published,topic,term,domain,language,valid,de,title,description,en,la,url,image,archive,content,quote,added,feed,country,ipcc,continent
acf144a673bb18a8c015dc169a198508,2026-05-04T06:46:20Z,Snow&Ice,kar yağışı,www.hurriyet.com.tr,tr,0.9,"Während wir auf den Frühling warteten, ist der Winter gekommen! Der Schneefall im Mai zeigte Wirkung... „Als wir morgens aufwachten, begrüßte uns eine Überraschung.“ Im Mai gab es in einigen Provinzen eine Schneeüberraschung. Viele hochgelegene Viertel in Mersin waren vom Schneefall, der am Morgen begann, weiß bedeckt. Es wurde festgestellt, dass die Schneehöhe stellenweise bis zu 10 Zentimeter erreichte. Häuptling İbrahi erklärte, dass sie im Schnee aufgewacht seien …",Baharı beklerken kış geldi! Mayısta kar yağışı etkili oldu... 'Sabah kalktığımızda bizi bir sürpriz karşıladı',"Bazı illlerde mayıs ayında kar sürprizi yaşandı. Mersin'de yüksek rakımlı birçok mahalle, sabaha karşı etkili olan kar yağışıyla beyaza büründü. Kar kalınlığının yer yer 10 santimetreye kadar ulaştığı öğrenildi. Güne karla uyandıklarını belirten muhtar İbrahi…","While we were waiting for spring, winter has come! Snowfall in May was effective... 'When we woke up in the morning, a surprise greeted us'. There was a snow surprise in some provinces in May. Many high-altitude neighborhoods in Mersin were covered in white with the snowfall that started in the morning. It was learned that the snow depth reached up to 10 centimeters in places. Headman İbrahi stated that they woke up to snow…","Dum ver exspectabamus, hiems venit! Nix mense Maio efficax erat. In nonnullis provinciis mense Maio nix mirum fuit. Multae viciniae altae altitudinis in Mersin albae nix obductae sunt quae mane incepit. Cognitum est altitudinem nivis usque ad 10 centimetra in locis pervenisse. Headman İbrahi asseruit se nix experrectus…",https://www.hurriyet.com.tr/galeri-bahari-beklerken-kis-geldi-mayista-kar-yagisi-etkili-oldu-sabah-kalktigimizda-bizi-bir-surpriz-karsiladi-43165500,https://image.hurimg.com/i/hurriyet/90/0x0/69f83cf01a51e84fd6f4dfce.jpg,,"Hava scaklklarnn ani düüüyle birlikte balayan kar ya, bata Radar bölgesi olmak üzere yüksek rakml alanlarda youn ekilde görüldü. Beyaza bürünen doa kartpostallk görüntüler olutururken, özellikle çiçe… [+298 chars]",,2026-05-09 11:29:01+00:00,random,,,
19c5e7904fd9475acd418dc4cd4b1666,2026-05-04T12:01:00Z,Snow&Ice,kar yağışı,www.haber7.com,tr,0.9,Der Schneefall war in İzmir Ödemiş wirksam. Die höheren Lagen im Bezirk Ödemiş in Izmir wurden durch den Schneefall weiß.,İzmir Ödemiş'te kar yağışı etkili oldu,İzmir'in Ödemiş ilçesinde yüksek kesimler kar yağışıyla beyaza büründü.,Snowfall was effective in İzmir Ödemiş. The higher elevations in İzmir's Ödemiş district turned white with snowfall.,Snowfall valuit in zmir demiş. Elevationes superiores in regione zmir in -demiş nix dealbata versa sunt.,https://www.haber7.com/guncel/haber/3625205-izmir-odemiste-kar-yagisi-etkili-oldu,https://i12.haber7.net//haber/haber7/og_image/2026/19/izmir_odemiste_kar_yagisi_etkili_oldu_1777896081_5089.jpg,,"zmir'in Ödemi ilçesine bal Bozda ile Gölcük mahallelerinde dün balayan kar ya gece ve bu sabah da aralklarla etkisini gösterdi.
Yollar, caddeler ile araçlarn karla kapland mahallelerde, souk hava da… [+347 chars]",,2026-05-09 11:29:01+00:00,random,,,
c1e93c627567d4aab5240e969f5e0ccd,2026-05-05T07:03:26Z,Snow&Ice,kar yağışı,www.hurriyet.com.tr,tr,0.9,"Alles wurde weiß! Sie waren unter dem Schnee gefangen: „Ein solcher Schneefall ereignete sich vor etwa 16 Jahren.“ Nach wiederholten Warnungen der Generaldirektion für Meteorologie kommt es im Mai in den meisten Teilen des Landes weiterhin zu starken Schneefällen. In diesen Tagen, in denen Frühlingstemperaturen zu erwarten sind, wirkt sich Schneefall negativ auf das Leben aus, während Transportstörungen ...",Her yer beyaza büründü! Karın altında kaldılar: 'Bu şekilde bir kar yağışı yaklaşık 16 yıl önce yaşanmıştı',"Meteoroloji Genel Müdürlüğü'nün üst üste yaptığı uyarıların ardından, mayıs ayında yurdun büyük bir bölümünde kar yağışı etkili olmaya devam ediyor. Bahar sıcaklıklarının beklendiği bu günlerde kar yağışı hayatı olumsuz etkilerken, ulaşımda yaşanan aksamalar …","Everything turned white! They were trapped under the snow: 'Such a snowfall occurred about 16 years ago.' Following repeated warnings by the General Directorate of Meteorology, snowfall continues to be effective in most parts of the country in May. In these days when spring temperatures are expected, snowfall negatively affects life, while transportation disruptions...","Omnia alba verterunt! Capti sunt sub nivibus: ""Talis nix facta est ante annos circiter XVI."" Post iteratas admonitiones a Directoratu Generali Meteorologico, nix efficax pergit in pluribus patriae partibus mense Maio. His diebus cum vere temperaturae exspectantur, nix negatio vitam afficit, dum translationem discidia...",https://www.hurriyet.com.tr/galeri-her-yer-beyaza-burundu-karin-altinda-kaldilar-bu-sekilde-bir-kar-yagisi-yaklasik-16-yil-once-yasanmisti-43166329,https://image.hurimg.com/i/hurriyet/90/0x0/69f9943b866d2a00cd55b37f.jpg,,"Helvadere beldesi’nde yaayan Sinan Koçaba,”Geçen ylda meyve aaçlarmz 10 Nisanda yaan karla souk almt. Bu ylda 5 Mays'ta yaan karla souk ald. lk kez mays aynda kar yadna ahitlik ettik olduk.”dedi.
Ko… [+143 chars]",,2026-05-09 11:29:01+00:00,random,,,
bf69bf197a32bb8f1d2fa5ec4d2171ca,2026-05-07T07:25:34Z,Snow&Ice,kar yağışı,www.aa.com.tr,tr,0.9,Der Schneefall war in Bayburt wirksam. Nach dem nächtlichen Schneefall in Bayburt wurde die Stadt weiß.,Bayburt'ta kar yağışı etkili oldu,Bayburt'ta gece saatlerinde etkili olan kar yağışının ardından kent beyaza büründü.,"Snowfall was effective in Bayburt. After the snowfall in Bayburt at night, the city turned white.",Snowfall efficax in Bayburt. Post noctem in Bayburt nix albam civitatem convertit.,https://www.aa.com.tr/tr/gundem/bayburtta-kar-yagisi-etkili-oldu/3929722,https://web-cdnprod.aa.com.tr/uploads/Contents/2026/05/07/thumbs_b_c_e9041316045e96f84a00bc56ac0a5773.jpg,,"Kentte dün akam saatlerinde balayan yamur, gece saatlerinden itibaren kent merkezi ve yüksek kesimlerde kara dönütü.
ehri çevreleyen dalar, yala beyaz örtüyle kapland.
Aralklarla sisin de etkili ol… [+126 chars]",,2026-05-09 11:29:01+00:00,random,,,
e08600a4a7ccef62f08b915d9460fd92,2026-05-02T06:57:00Z,Drought,kuraklık,www.haber7.com,tr,0.9,"Durch Dürre überschwemmt: Heftige Regenfälle verschluckten zwei Dörfer in Hatay. Der Reyhanlı-Staudamm, der aufgrund übermäßiger Regenfälle in Hatay seine volle Kapazität erreichte, überschwemmte die in der Vergangenheit evakuierten Dörfer Karakaya und Acer. Der Anstieg des Wassers in der Region, die letztes Jahr unter Dürre litt, sorgte für eindrückliche Szenen.",Kuraklıktan sular altına: Hatay'da aşırı yağışlar iki köyü yuttu,"Hatay'da aşırı yağışların etkisiyle tam kapasiteye ulaşan Reyhanlı Barajı, geçmişte tahliye edilen Karakaya ve Acer köylerini sular altında bıraktı. Geçen yıl kuraklık çeken bölgede suların yükselmesiyle çarpıcı manzaralar oluştu.","Flooded from drought: Heavy rains swallowed two villages in Hatay. Reyhanlı Dam, which reached full capacity due to excessive rainfall in Hatay, flooded the villages of Karakaya and Acer, which had been evacuated in the past. Striking scenes were created with the rise of water in the region, which suffered from drought last year.","Inundata ex siccitate: Imbres graves duas villas in Hatay deglutiverunt. Reyhanlı Dam, quae plenam facultatem ob nimiam pluviam in Hatay attigit, villas Karakaya et Acer inundavit, quae antehac evacuatae erant. scaenae laetissimae cum aquae in regione ortum creatae sunt, quae superiore anno siccitate laborabant.",https://www.haber7.com/foto-galeri/97050-kurakliktan-sular-altina-hatayda-asiri-yagislar-iki-koyu-yuttu,https://i20.haber7.net/resize/1280x720//fotogaleri/haber7/album/2026/18/B542z_1777704939_4028_w750_h421.jpg,,"Hatay'da ar yalarn etkisiyle tam kapasiteye ulaan Reyhanl Baraj, geçmite tahliye edilen Karakaya ve Acer köylerini sular altnda brakt. Geçen yl kuraklk çeken bölgede sularn yükselmesiyle çarpc manzar… [+10 chars]",,2026-05-09 16:32:05+00:00,random,,,
ec6d10dfb119dc6af9726eeb4c3beff4,2026-05-03T11:17:57Z,Drought,kuraklık,www.yenicaggazetesi.com,tr,0.9,"Von der Dürre zum Überfluss: Ekşili-Teich. Der Ekşili-Teich in Antalya, der letztes Jahr aufgrund von Dürre und unbewusster Bewässerung auf Drohnenbildern als „verödet“ zu sehen war, war dieses Jahr durch die starken Regenfälle vollständig gefüllt.",Kuraklıktan bolluğa erdi: Ekşili Göleti,"Antalya'da yer alan Ekşili Göleti, geçen yıl kuraklık ve bilinçsiz sulama nedeniyle dron görüntülerine ""çölleşmiş"" haliyle yansıyan gölet, bu yılki yoğun yağışlarla birlikte tamamen doldu.","From drought to abundance: Ekşili Pond. Ekşili Pond in Antalya, which was reflected in drone images as ""desertified"" last year due to drought and unconscious irrigation, was completely filled with this year's heavy rains.","Ab siccitate ad abundantiam : Ekşili Stagno. Ekşili lacum in Antalya, quod in imaginibus fucis ""desertum"" relucebat, ultimo anno propter siccitatem et irrigationem nescientem, huius anni imbribus perfecte repleta est.",https://www.yenicaggazetesi.com/kurakliktan-bolluga-erdi-eksili-goleti-1025685h.htm,https://img.yenicaggazetesi.com/rcman/Cw1280h720q95gc/storage/files/images/2026/05/03/kurakliktan-bolluga-erdi-eksili-goleti-bhmh.jpg,,"Antalya'nn Ekili Mahallesi'nde hem tarmsal sulama hem de sportif balkçlk için hayati önem tayan Ekili Göleti, son yllarn en yüksek su seviyesine ulat. Geçen yl kuraklk ve bilinçsiz sulama nedeniyle d… [+1296 chars]",,2026-05-09 16:32:05+00:00,random,,,
35d3967e92fbd2152c554b7b3b390528,2026-05-05T09:40:00Z,Drought,kuraklık türkiye,ekonomi.haber7.com,tr,0.9,"Zum Jahresende wird es noch weiter steigen: Die Kaffeepreise sind in den letzten 4 Jahren um 780 Prozent gestiegen. Aufgrund der Zölle und der Dürre in Brasilien haben die Kaffeepreise ein Rekordniveau erreicht. In der Türkei hat Filterkaffee die Grenze von 110 TL und türkischer Kaffee die Grenze von 200 TL erreicht. Es wird erwartet, dass die Zahlen bis zum Jahresende weiter steigen.",Yıl sonunda daha da artacak: Kahve fiyatları son 4 yılda yüzde 780 zamlandı,"Kahve fiyatları, tarifeler ve Brezilya'daki kuraklık nedeniyle rekor seviyeye yaklaştı. Türkiye'de ise filtre kahve 110 TL’ye, Türk kahvesi ise 200 TL sınırına dayandı. Rakamların yıl sonunda daha da artması bekleniyor.","It will increase even more at the end of the year: Coffee prices have increased by 780 percent in the last 4 years. Coffee prices have reached record levels due to tariffs and drought in Brazil. In Türkiye, filter coffee has reached the limit of 110 TL and Turkish coffee has reached the limit of 200 TL. The numbers are expected to increase further by the end of the year.","Plus etiam in fine anni crescet: Coffee pretia aucta sunt 780 cento in proximis 4 annis. Pretia capulus pervenerunt ex portoriis et siccitatibus in Brasilia recordum gradus. In Türkiye, colum capulus limitem 110 TL et capulus Turcicum pervenit ad limitem 200 TL. Numeri a fine anni longius augeri exspectantur.",https://ekonomi.haber7.com/ekonomi/haber/3625436-yil-sonunda-daha-da-artacak-kahve-fiyatlari-son-4-yilda-yuzde-780-zamlandi,https://i12.haber7.net//haber/haber7/og_image/2026/19/cOPzu_1777973676_3494.jpg,,"Kahve severleri üzen gelime...
Bata Brezilya olmak üzere Latin Amerika ülkelerinde bir süredir yaanan kuraklk, küresel kahve fiyatlarn vurmaya devam ediyor.
FYATLAR TARH ZRVEY GÖRDÜ
Bu duruma gümr… [+1678 chars]",,2026-05-09 16:32:05+00:00,edo,Turkey,MED,Asia
c88989bd3b286b9fed3ff0d5ed171764,2026-05-07T10:00:00Z,Storm,fırtına,www.yenicaggazetesi.com,tr,0.9,"Dieses Mal kommt El Nino „Super“: Dürre, Hitze, Sturm ... Wann wird es Türkiye erreichen? El Nino, das die Temperaturen enorm ansteigen lässt und Dürren, Hungersnöte sowie Hurrikane und Stürme verursacht, wird dieses Mal mit dem Adjektiv „super“ versehen. Experten fordern Vorkehrungen für El Niño, das auch Türkiye treffen wird.","El Nino bu kez 'Süper' geliyor: Kuraklık, sıcak, fırtına... Türkiye'yi ne zaman vuracak","Sıcaklıkları akıl almaz derecede artırıp kuraklıklara, kıtlıklara aynı zamanda da kasırga ve fırtınalara neden olan El Nino, bu kez 'süper' sıfatıyla da geliyor. Türkiye'ye de uğrayacak olan El Nino için uzmanlar önlem çağrısında bulunuyor.","This time El Nino is coming 'Super': Drought, heat, storm... When will it hit Türkiye? El Nino, which increases temperatures incredibly and causes droughts, famines, as well as hurricanes and storms, this time comes with the adjective of 'super'. Experts are calling for precautions for El Niño, which will also affect Türkiye.","Hoc tempore El Nino venit Super: Siccitas, aestus, tempestas... Quando Türkiye percutiet? El Nino, quae calores incredibiliter auget et siccitates, fames, ac procellas et procellas causat, hoc tempus venit cum adiectivo ""super"". Periti rogant cautiones pro El Niño, quae etiam Türkiye afficiunt.",https://www.yenicaggazetesi.com/el-nino-2026-ne-zaman-gelecek-uzmanlar-ne-diyor-super-el-ninonun-etkisi-ne-olacak-2027-en-sicak-yil-mi-1027024h.htm,https://img.yenicaggazetesi.com/rcman/Cw1280h720q95gc/storage/files/images/2026/05/07/el-nino-2026-ne-zaman-gelecek-uzmanlar-ne-diyor-super-el-ninonun-etkisi-ne-olacak-2027-en-sicak-yil-mi-uo0b.jpg,,"TARİHİN EN SICAK YILI MI OLACAK?
Bilim insanları, El Nino’nun yaratacağı doğal ısınmanın, insan kaynaklı iklim değişikliği ile birleştiğinde yıkıcı bir sinerji oluşturacağını vurguluyor. Tahminler, … [+207 chars]",,2026-05-09 16:32:05+00:00,random,,,
36a438dee55bf35810d7bf6431acc4aa,2026-05-07T14:52:14Z,Drought,kuraklık,www.aa.com.tr,tr,0.9,"6,5 Millionen Menschen in Somalia sind von schwerer Ernährungsunsicherheit betroffen. Der humanitäre Koordinator der Vereinten Nationen (UN) für Somalia, George Conway, erklärte, dass sich die Hunger- und Unterernährungskrise aufgrund der Dürre im Land allmählich verschärft und dass etwa 6,5 ​​Millionen Menschen unter schwerem Hunger leiden werden.","Somali'de 6,5 milyon kişi ciddi gıda güvensizliğiyle karşı karşıya","Birleşmiş Milletler'in (BM) Somali İnsani Koordinatörü George Conway, ülkede kuraklık nedeniyle açlık ve yetersiz beslenme krizinin giderek derinleştiğini belirterek, yaklaşık 6,5 milyon kişinin şiddetli açlıkla karşı karşıya kalacağını bildirdi.",6.5 million people in Somalia face severe food insecurity. United Nations (UN) Somalia Humanitarian Coordinator George Conway stated that the hunger and malnutrition crisis is gradually deepening due to drought in the country and that approximately 6.5 million people will face severe hunger.,6.5 decies centena millia hominum in Somalia contra graves cibi suspiciones. Nationes Unitae (UN) Somalia Coordinator Humanitaria George Conway affirmavit famem et discrimen malnutritionis sensim augeri ob siccitatem ruri et circiter 6.5 miliones hominum famem gravem fore.,https://www.aa.com.tr/tr/dunya/somalide-6-5-milyon-kisi-ciddi-gida-guvensizligiyle-karsi-karsiya/3930350,https://web-cdnprod.aa.com.tr/uploads/Contents/2026/05/07/thumbs_b_c_29a1447290d3d499355c827ce0deaaa5.jpg,,"Conway, Somali'ye gerçekletirdii ziyaret kapsamnda hükümet yetkilileri, BM ekibi ve insani yardm yetkilileriyle görütü.
Somali'deki durumun ciddiyetini yerinde görmek için ülkenin farkl bölgelerini … [+635 chars]",,2026-05-09 16:32:05+00:00,random,,,
4defdb915e883e128fbbf2fb2deae7dd,2026-05-07T15:05:07Z,Drought,ani kuraklık,www.yenicaggazetesi.com,tr,0.9,"6,5 Millionen Menschen in Somalia sind von Ernährungsunsicherheit betroffen. Der humanitäre Koordinator der Vereinten Nationen (UN) für Somalia, George Conway, erklärte, dass sich die Hunger- und Unterernährungskrise aufgrund der Dürre im Land allmählich verschärft und dass etwa 6,5 ​​Millionen Menschen unter schwerem Hunger leiden werden.","Somali'de 6,5 milyon kişi gıda güvensizliğiyle karşı karşıya","Birleşmiş Milletler'in (BM) Somali İnsani Koordinatörü George Conway, ülkede kuraklık nedeniyle açlık ve yetersiz beslenme krizinin giderek derinleştiğini belirterek, yaklaşık 6,5 milyon kişinin şiddetli açlıkla karşı karşıya kalacağını bildirdi.",6.5 million people in Somalia face food insecurity. United Nations (UN) Somalia Humanitarian Coordinator George Conway stated that the hunger and malnutrition crisis is gradually deepening due to drought in the country and that approximately 6.5 million people will face severe hunger.,6.5 decies centena millia hominum in Somalia contra cibum suspiciones. Nationes Unitae (UN) Somalia Coordinator Humanitaria George Conway affirmavit famem et discrimen malnutritionis sensim augeri ob siccitatem ruri et circiter 6.5 miliones hominum famem gravem fore.,https://www.yenicaggazetesi.com/somalide-65-milyon-kisi-gida-guvensizligiyle-karsi-karsiya-1027267h.htm,https://img.yenicaggazetesi.com/rcman/Cw1280h720q95gc/storage/files/images/2026/05/07/somalide-65-milyon-kisi-gida-guvensizligiyle-karsi-karsiya-0zoo.jpg,,"Birlemi Milletler'in (BM) Somali nsani Koordinatörü George Conway, Somali'ye gerçekletirdii ziyaret kapsamnda hükümet yetkilileri, BM ekibi ve insani yardm yetkilileriyle görütü.
Somali'deki durumun… [+693 chars]",,2026-05-09 16:32:05+00:00,random,,,
b4227d105fcd845567f8aa6b9e7e3346,2026-05-07T14:18:18Z,Thunderstorm,dolu,www.yenicaggazetesi.com,tr,0.9,"Ein emotionaler Abend mit Volksliedern. Der KİGDER-Chor, der im Rahmen der Veranstaltungen zum 20-jährigen Jubiläum der Aksaray-Universität und des Frühlingsfestivals auftrat, brachte Kunstliebhaber mit dem Konzert „Ein Volkslied, tausend Emotionen“ zusammen. Das Konzert, bei dem unvergessliche Werke türkischer Volksmusik aufgeführt wurden, erfreute sich einer regen Beteiligung…",Türkülerle duygu dolu gece,"Aksaray Üniversitesinin 20. kuruluş yılı etkinlikleri ve Bahar Şenlikleri kapsamında sahne alan KİGDER Korosu, “Bir Türkü, Bin Duygu” konseriyle sanatseverleri bir araya getirdi. Türk halk müziğinin unutulmaz eserlerinin seslendirildiği konser, yoğun katılıml…","An emotional night with folk songs. KİGDER Choir, which performed within the scope of Aksaray University's 20th anniversary events and Spring Festivals, brought art lovers together with the ""One Folk Song, Thousand Emotions"" concert. The concert, where unforgettable works of Turkish folk music were performed, was attended by intense participation…","Motus nox cum vulgares carmina. KİGDER Choir, qui intra XX anniversarium Aksaray Universitatis ambitum eventa et ver festa celebravit, amatores simul cum ""Uno Folk Song, Mille affectuum"" concentu attulit. Concentus, ubi memorabilia opera musicae popularis Turcicae fiebant, ingenti participatione secuta est.",https://www.yenicaggazetesi.com/turkulerle-duygu-dolu-gece-1027239h.htm,https://img.yenicaggazetesi.com/rcman/Cw1280h720q95gc/storage/files/images/2026/05/07/turkulerle-duygu-dolu-gece-yepr.jpg,,"Aksaray / Metin Kurt / Yeniçağ
Aksaray Üniversitesinin 20. kuruluş yılı etkinlikleri ve Bahar Şenlikleri kapsamında sahne alan KİGDER Korosu, “Bir Türkü, Bin Duygu” konseriyle sanatseverleri bir ara… [+3307 chars]",,2026-05-10 07:41:01+00:00,random,,,
010c8a56d1e88a013b9ee29dd7c5e466,2026-05-08T06:50:40Z,Volcano,yanardağ patlaması,www.patronlardunyasi.com,tr,0.9,"Drei Bergsteiger kamen bei einer Vulkanexplosion in Indonesien ums Leben. Es wurde angegeben, dass drei Bergsteiger, die den Dukono-Vulkan bestiegen, der heute Morgen in Indonesien aktiv wurde, ihr Leben verloren und von zehn Bergsteigern niemand etwas hörte.",Endonezya'da yanardağ patlamasında 3 dağcı yaşamını yitirdi,"Endonezya'da bu sabah faaliyete geçen Dukono Yanardağı'na tırmanan 3 dağcının yaşamını yitirdiği, 10 dağcıdan da haber alınamadığı belirtildi.","3 climbers lost their lives in a volcano explosion in Indonesia. It was stated that 3 climbers who climbed the Dukono Volcano, which became active this morning in Indonesia, lost their lives and 10 climbers were not heard from.","3 viverra tellus in volcano explosione in Indonesia vitam amiserunt. Dictum est 3 viverra tellus qui Dukono Volcano ascenderunt, qui hoc mane in Indonesia agentes facti sunt, vitam amiserunt et 10 viverra tellus non audiverunt.",https://www.patronlardunyasi.com/endonezyada-yanardag-patlamasinda-3-dagci-yasamini-yitirdi,https://i.pdimage.com/static/content/26-05/08/endonezyada-yanardag-patlamasinda-3-dagci-yasamini-yitirdi.jpg,,"Channel News Asia'nn haberine göre, ülkenin North Maluku bölgesinde yer alan Dukono Yanarda faaliyete geçerek 10 kilometre kadar yükseklie kül püskürtmeye balad.
Bu srada daa trmanan daclardan 3'ünü… [+494 chars]",,2026-05-10 07:41:01+00:00,random,,,
5fafd04d4ab30c702e7f292c9f3773bc,2026-05-08T07:27:42Z,Volcano,yanardağ patlaması,anlatilaninotesi.com.tr,tr,0.9,"Vulkanexplosion in Indonesien: 20 Bergsteiger wurden gesucht, es kam die Nachricht vom Tod von drei. Die Suche nach insgesamt 20 Bergsteigern, die den Dukono-Vulkan bestiegen, der heute Morgen in Indonesien aktiv wurde, wurde fortgesetzt. Es wurde bekannt gegeben, dass am Morgen drei Bergsteiger ihr Leben verloren haben.","Endonezya'da yanardağ patlaması: 20 dağcı aranıyordu, 3'nün ölüm haberi geldi",Endonezya'da bu sabah faaliyete geçen Dukono Yanardağı'na tırmanan toplamda 20 dağcının arama çalışmalarına devam ediliyordu. Sabah saatlerinde 3 dağcının hayatını kaybettiği açıklandı.,"Volcano explosion in Indonesia: 20 climbers were wanted, news of the death of 3 came. Search efforts were continuing for a total of 20 climbers climbing the Dukono Volcano, which became active this morning in Indonesia. It was announced that 3 climbers lost their lives in the morning.","Volcano explosio in Indonesia: 20 viverra tellus desiderabatur, nuntius mortis 3 venit. Quaere nisus perdurabat ad summam 20 ascendentium ascendentium in Dukono Volcano, quae hoc mane in Indonesia activa facta est. Nuntiatum est quod 3 tellus vitae amiserunt mane.",https://anlatilaninotesi.com.tr/20260508/endonezyada-yanardag-patlamasi-20-dagci-araniyordu-3nun-olum-haberi-geldi-1105584654.html,https://cdn.img.anlatilaninotesi.com.tr/images/sharing/article/tur/1105584654.jpg?11055853201778225262,,"Rusya, ABD, Avrupa ve Ortadou bata olmak üzere dünyann dört bir yanndan son dakika haberleri, analizler ve özel dosyalar.
https://anlatilaninotesi.com.tr/20260508/endonezyada-yanardag-patlamasi-20-d… [+2871 chars]",,2026-05-10 07:41:01+00:00,random,,,
23b0657d21922eaf5d465f2aa0b2f82b,2026-05-08T08:19:00Z,Earthquake,deprem,ekonomi.haber7.com,tr,0.9,"Minister Kurum kündigte die neue Vision des Städtebaus an: Hier ist der neue Weg, dem man folgen muss. Murat Kurum, Minister für Umwelt, Urbanisierung und Klimawandel, teilte wichtige Zahlen vom massiven Bauprozess in der Erdbebenzone bis hin zu sozialen Wohnungsbauprojekten mit; Er verkündete, dass jeden Tag 550 Häuser und jede Stunde 23 Häuser fertiggestellt würden.",Bakan Kurum yeni şehircilik vizyonunu açıkladı: İşte izlenecek yeni rota,"Çevre, Şehircilik ve İklim Değişikliği Bakanı Murat Kurum, deprem bölgesindeki devasa inşaat sürecinden sosyal konut projelerine kadar kritik rakamları paylaştı; her gün 550, her saatte ise 23 konutun tamamlandığını müjdeledi.","Minister Kurum announced the new urbanism vision: Here is the new route to follow. Murat Kurum, Minister of Environment, Urbanization and Climate Change, shared critical figures from the massive construction process in the earthquake zone to social housing projects; He heralded that 550 houses were completed every day and 23 houses were completed every hour.","Minister Kurum novam urbanismi visionem nuntiavit: Hic est nova via ut sequaris. Murat Kurum, minister Environment, Urbanizationis et Clima Mutationis, figuras criticas a mole constructionis processus communicavit in zona terraemotus ad incepta socialia habitationi; Diem dixit compleri domos DL, ac XXIII domibus compleri omnibus horis.",https://ekonomi.haber7.com/ekonomi/haber/3626219-bakan-kurum-yeni-sehircilik-vizyonunu-acikladi-iste-izlenecek-yeni-rota,https://i12.haber7.net//haber/haber7/og_image/2025/46/bakan_kurumdan_deprem_bolgesinde_yapimi_tamamlanan_350_bininci_konuta_iliskin_paylasim_1763028345_477.jpg,,"Çevre, ehircilik ve klim Deiiklii Bakan Murat Kurum, kentsel dirençliliin insan, ekonomiyi ve çevreyi güçlendiren bir vizyona dönütüünü belirterek, Türkiye'nin afet sonras ina sürecinde dünya çapnda … [+3086 chars]",,2026-05-10 07:41:01+00:00,random,,,
