index,published,topic,term,domain,language,valid,de,title,description,en,la,url,image,archive,content,quote,added,feed,country,ipcc,continent
c6107bd95fd3ae1c79ea2a39dbb62f24,2026-03-03T05:30:00Z,Heat Wave,ısı,www.hurriyet.com.tr,tr,0.9,"Achtung: Er bemerkte es beim Teekochen... Was er Tage später erfuhr, veränderte sein Leben. Das Leben der 51-jährigen Tammy Jackson, Mutter von sechs Kindern, wurde eines Morgens auf den Kopf gestellt, als in der Mitte ihres Auges ein schwarzer Fleck erschien. Zuerst achtete er nicht auf den „Lichtschein“, den er beim Teezubereiten bemerkte, aber er öffnete die Tür zu einem furchterregenden Prozess, den sie innerhalb weniger Tage erlebten.",Dikkat: Çay yaparken fark etti… Günler sonra öğrendiği şey hayatını değiştirdi,"Altı çocuk annesi 51 yaşındaki Tammy Jackson’ın hayatı, bir sabah gözünün ortasında beliren siyah bir lekeyle altüst oldu. Çay yaparken fark ettiği “ışık parlamasını” önce önemsemedi, ancak günler içinde yaşadıkları korku dolu bir sürecin kapısını araladı","Attention: He noticed while making tea... What he learned days later changed his life. The life of 51-year-old Tammy Jackson, a mother of six children, was turned upside down one morning when a black spot appeared in the middle of her eye. At first he did not pay attention to the ""shine of light"" he noticed while making tea, but it opened the door to a fearful process that they experienced within days.","Animadvertit: Animadvertit dum tea ... Quod didicit post dies vitam mutavit. Tammy Jackson vita 51 annorum, mater sex liberorum, unum mane inverso est cum macula nigra in medio oculi eius apparuit. Primo non attendit ""lucis lucere"" dum tea faciens animadvertit, sed ianuam tremendo processui, quem intra dies experiebatur, aperuit.",https://www.hurriyet.com.tr/aile/galeri-dikkat-cay-yaparken-fark-etti-gunler-sonra-ogrendigi-sey-hayatini-degistirdi-43115103,https://image.hurimg.com/i/hurriyet/90/0x0/699d4cdda802d8e347621188.jpg,,"Yaadklarndan sonra göz sal konusunda farkndalk yaratmak istediini söyleyen Jackson, u çarda bulundu: “En önemli ey u: Göz muayenesi yaptrmanz gerekiyorsa, yaptrn. Ertelemeye gerçekten demez. Çok kola… [+741 chars]",,2026-03-07 20:53:28+00:00,random,,,
6ffc555800aa5d05094bededef859441,2026-03-04T12:24:00Z,Heat Wave,ısı,www.hurriyet.com.tr,tr,0.9,"Beyaz und Joker sind an ihrem neuen Tag auf Kanal D! Die beliebte Wettbewerbssendung Beyaz'la Joker von Kanal D bereitet sich darauf vor, ihr Publikum am neuen Sendetag zu treffen. Beyazıt Öztürk, der mit seinem dynamischen und aufrichtigen Vortrag die Herzen des Publikums eroberte, wird nun dienstags vor dem Publikum auftreten.",Beyaz'la Joker yeni gününde Kanal D'de!,"Kanal D’nin sevilen yarışma programı Beyaz’la Joker, yeni yayın gününde izleyicisiyle buluşmaya hazırlanıyor. Dinamik ve samimi sunumuyla izleyicinin gönlünde taht kuran Beyazıt Öztürk, artık salı günleri seyirci karşısına çıkacak.","Beyaz and Joker are on Kanal D on their new day! Kanal D's popular competition program Beyaz'la Joker is getting ready to meet its audience on the new broadcast day. Beyazıt Öztürk, who won the hearts of the audience with his dynamic and sincere presentation, will now appear before the audience on Tuesdays.","Beyaz and Joker are on Kanal D on their new day! Kanal D's programmata popularis certationis Beyaz'la Scurra incipit in auditorio suo obviam novo die iaci. Beyazıt Öztürk, qui animos audientium dynamica ac sincera praesentatione conciliavit, nunc die Martis coram auditorio apparebit.",https://www.hurriyet.com.tr/kelebek/televizyon/beyazla-joker-yeni-gununde-43121288,https://image.hurimg.com/i/hurriyet/90/0x0/69a8245e717271c959b2c273.jpg,,"p&gt;SALI EKRANINDAN KAHKAHA YÜKSELECEKYüksek tempolu anlar, beklenmedik sürprizleri ve artan heyecanyla dikkat çeken yarma Beyazla Joker, artk sal günü seyirciyle buluacak. Elence dolu dakikalar ve … [+407 chars]",,2026-03-07 20:53:28+00:00,random,,,
3779ee9fc8de2b8dd44616f303c748e7,2026-03-06T09:06:39Z,Thunderstorm,dolu,www.hurriyet.com.tr,tr,0.9,"Es ist ein echtes Superfood, bekommt aber nicht den Wert, den es verdient! Die meisten Menschen nehmen es nur durch Kochen zu sich. Es handelt sich um ein kalorienarmes, nährstoffreiches und gesundes Lebensmittel, das die meisten von uns jedoch selten zu sich nehmen. Darüber hinaus töten wir durch das Kochen fast alle Vitamine ab. Wir können es jedoch mit einer Vielzahl köstlicher Zubereitungsmethoden zum Kronjuwel auf dem Tisch machen. Idiom…",O tam bir süper besin ama hak ettiği değeri görmüyor! Çoğu insan sadece haşlayarak tüketiyor,"Kalorisi düşük, besin değeri yüksek, sağlık dolu bir besin ama çoğumuz onu nadiren tüketiyoruz. Üstelik haşlayarak neredeyse bütün vitaminlerini öldürüyoruz. Oysa çok çeşitli ve leziz pişirme yöntemleriyle, onu sofraların baş tacı haline getirebiliriz. Deyim …","It's a true superfood, but it doesn't get the value it deserves! Most people only consume it by boiling it. It is a food that is low in calories, high in nutritional value and full of health, but most of us rarely consume it. Moreover, we kill almost all of its vitamins by boiling it. However, we can make it the crown jewel of the table with a wide variety of delicious cooking methods. Idiom…","Verus est super cibum, sed non valet pretium! Plerique tantum decoquendo consumunt. Cibus est humilis in calories, altus in nutritionis valore et plenus sanitate, sed plerique raro eum consumunt. Quinetiam fere omnem vitamins eius decoquendo occidimus. Sed possumus facere coronam gemmam mensae cum varietate delectamenti coquendi modos. Idiom…",https://www.hurriyet.com.tr/aile/galeri-o-tam-bir-super-besin-ama-hak-ettigi-degeri-gormuyor-cogu-insan-sadece-haslayarak-tuketiyor-43121173,https://image.hurimg.com/i/hurriyet/90/0x0/69a80681a802d8e347623afc.jpg,,"Kullanlabilir enerjinin yan sra hormon ve krmz kan hücrelerinin üretiminde de rol oynar, bu da onu günlük metabolik ilevler için önemli klar.
Karnabahar, pantotenik asit ve B6 vitamini içeriinin yan… [+181 chars]",,2026-03-07 20:53:28+00:00,random,,,
952b87531a92339b52271bc1607b4830,2026-03-02T10:54:33Z,Tropical Cyclone,kasırga,www.yenicaggazetesi.com,tr,0.9,"Spezielles Video der Scorpions für die Türkei: „Wir werden Istanbul wie ein Hurrikan erschüttern.“ Die legendäre Rockband Scorpions veröffentlichte vor ihrem Konzert in Istanbul am 24. Juni 2026 eine besondere Videobotschaft an ihre türkischen Fans. Solist Klaus Meine brachte die Aufregung auf den Höhepunkt, indem er sagte: „Wir werden Istanbul wie ein Hurrikan erschüttern.“",Scorpions’tan Türkiye’ye özel video: “İstanbul’u kasırga gibi sallayacağız”,"Rock müziğin ikonik grubu Scorpions, 24 Haziran 2026’da İstanbul’da sahne alacağı konser öncesi Türk hayranlarına özel bir video mesaj yayımladı. Solist Klaus Meine, “İstanbul’u kasırga gibi sallayacağız” diyerek heyecanı doruğa çıkardı.","Scorpions' special video for Turkey: ""We will shake Istanbul like a hurricane"". The iconic rock band Scorpions released a special video message to their Turkish fans before their concert in Istanbul on June 24, 2026. Soloist Klaus Meine brought the excitement to its peak by saying, ""We will shake Istanbul like a hurricane.""","Scorpionum speciale video pro Turcia: ""Istanbul sicut procellae excutiemus"". Scorpionum globus petra iconica singularem video nuntium emisit ad eorum fans turcicas ante concentus Istanbul die 24 mensis Iunii anno 2026. Soloist Klaus Meine incitationem ad summum attulit dicendo ""Istanbul sicut procellae excutiemus"".",https://www.yenicaggazetesi.com/scorpionstan-turkiyeye-ozel-video-istanbulu-kasirga-gibi-sallayacagiz-1005361h.htm,https://img.yenicaggazetesi.com/rcman/Cw1280h720q95gc/storage/files/images/2026/03/02/scorpionstan-turkiyeye-ozel-video-istanbulu-kasirga-gibi-sallayacagiz-ylu9.jpg,,"60 yıllık müzik kariyeriyle rock tarihine damga vuran Scorpions, Beşiktaş Tüpraş Stadyumu’nda vereceği konser için BKM Organizasyonu’nun düzenlediği etkinlik öncesinde Türkiye’ye seslendi.“
İSTANBUL… [+515 chars]",,2026-03-08 10:54:39+00:00,random,,,
6f6069afa0e6fd43a61f8ee37d4a0c64,2026-03-02T11:20:36Z,Storm,fırtına,www.chip.com.tr,tr,0.9,"Pentagon-Deal löste Kontroversen aus: OpenAI gab erstmals Einzelheiten bekannt. Die zwischen OpenAI und dem US-Verteidigungsministerium unterzeichnete Vereinbarung eroberte die Technologiewelt im Sturm. Während CEO Sam Altman zugibt, dass der Prozess überstürzt erfolgte, behauptet das Unternehmen, dass es hinter seinen roten Linien stehe.",Pentagon anlaşması tartışma yarattı: OpenAI detayları ilk kez açıkladı,"OpenAI ile ABD Savunma Bakanlığı arasında imzalanan anlaşma teknoloji dünyasında fırtına kopardı. CEO Sam Altman sürecin aceleye geldiğini kabul ederken şirket, kırmızı çizgilerinin arkasında durduğunu savunuyor.","Pentagon deal created controversy: OpenAI announced the details for the first time. The agreement signed between OpenAI and the US Department of Defense took the technology world by storm. While CEO Sam Altman admits that the process was rushed, the company maintains that it stands behind its red lines.","Pentagonum multum controversiam creavit: OpenAI singula primum denuntiavit. Conventio inter OpenAI et US Department Defensionis signata mundum technologiam vi cepit. Dum CEO Sam Altman fatetur processum festinari, societas affirmat post lineas rubras stare.",https://www.chip.com.tr/guncel/pentagon-anlasmasi-tartisma-yaratti-openai-detaylari-ilk-kez-acikladi_178130.html,https://img.chip.com.tr/rcman/Cw1280h720q95gm/storage/files/images/2026/03/02/pentagon-anlasmasi-tartisma-yaratti-openai-detaylari-ilk-kez-acikladi-nqll.png,,"OpenAI, ABD Savunma Bakanlığı ile yaptığı anlaşmaya ilişkin daha fazla ayrıntı paylaştı. CEO Sam Altman’ın kendi ifadesiyle anlaşma “kesinlikle aceleye geldi” ve “görüntü iyi durmuyor.” Geçtiğimiz cu… [+4381 chars]",,2026-03-08 10:54:39+00:00,random,,,
a4b9c336c69570f298ad01eba2d2ba3a,2026-03-04T09:01:04Z,Storm,fırtına,www.hurriyet.com.tr,tr,0.9,"Die jungen Leute von Sarıçam wehten wie ein Sturm. Die MaestRobot Mediterranean Regional Championship, die als eine der umfassendsten Robotikorganisationen in der Region gilt, fand im Mersiner Bezirk Toroslar statt. Das Robotic Coding Team der Gemeinde Sarıçam erreichte mit seinem Erfolg in drei Zweigen der Meisterschaft bedeutende Platzierungen…",Sarıçam'ın gençleri fırtına gibi esti,Mersin'in Toroslar ilçesinde bölgenin en kapsamlı robotik organizasyonlarından biri olarak gösterilen The MaestRobot Akdeniz Bölge Şampiyonası düzenlendi. Sarıçam Belediyesi Robotik Kodlama Takımı şampiyonada üç daldaki başarısı ile önemli dereceler elde eder…,"The young people of Sarıçam blew like a storm. The MaestRobot Mediterranean Regional Championship, which is considered one of the most comprehensive robotics organizations in the region, was held in Toroslar district of Mersin. Sarıçam Municipality Robotic Coding Team achieved significant rankings with its success in three branches in the championship…","iuvenes Sarıçam cecinerunt ut tempestas. MaestRobot Championship Regionalis Mediterraneae, quae consideratur una e latissimum Institutis roboticis in regione, in regione Toroslar Mersin habita est. Sarıçam Municipality Robotic Coding Team significantes gradus consecuti sunt cum successu trium ramorum in pilae…",https://www.hurriyet.com.tr/yazarlar/erdal-fernergiz/saricamin-gencleri-firtina-gibi-esti-43121123,https://image.hurimg.com/i/hurriyet/90/0x0/5b9f69cd18c7730244347c25.jpg,,p&gt;Yunus Emre Kültür Merkezinde gerçekletirilen ve The MaestRobot Robotics Competition ve Festival kapsamnda düzenlenen ampiyonaya 250 takm ve 1200 örenci katld. Estonya merkezli Robotex Internatio… [+1408 chars],,2026-03-08 10:54:39+00:00,random,,,
dca81e3903582630e686422561a0ce39,2026-03-04T09:06:43Z,Heat Wave,ısı,www.chip.com.tr,tr,0.9,"Der Name der neuen Krise im Kino ist Tillyverse: Die Schauspielerin mit künstlicher Intelligenz stellt ihre eigene Besetzung zusammen. Der Erfolg der digitalen Figur Tilly Norwood öffnete die Türen zu einer neuen, auf künstlicher Intelligenz basierenden Casting-Agentur. Während Hollywood-Gewerkschaften reagieren und es als „Arbeitsdiebstahl“ bezeichnen, produzieren Technologiegiganten neue Charaktere, die nicht von echten Schauspielern zu unterscheiden sind.",Sinemada yeni krizin adı Tillyverse: Yapay zeka aktris kendi kadrosunu kuruyor,"Tilly Norwood isimli dijital karakterin başarısı, yapay zeka tabanlı yeni bir oyuncu ajansının kapılarını araladı. Hollywood sendikaları ""emek hırsızlığı"" diyerek tepki gösterirken, teknoloji devleri gerçek oyunculardan ayırt edilemeyen yeni karakterlerle sek…","The name of the new crisis in cinema is Tillyverse: The artificial intelligence actress is assembling her own cast. The success of the digital character named Tilly Norwood opened the doors to a new artificial intelligence-based casting agency. While Hollywood unions react by calling it ""labor theft"", technology giants are producing new characters that are indistinguishable from real actors.","Nomen novae discriminis in cinematographico Tillyverse est: mima artificiosa intellegentiae suum missum convenit. Successu characteris digitalis nomine Tilly Norwood ianuas aperuit ad novam intelligentiam artificialem substructio agentis deiectionem. Dum Uniones Hollywood agunt, illud ""furtum laboris"" vocant, gigantes technologiae novas notas gignunt, quae ab actoribus realibus discerni non possunt.",https://www.chip.com.tr/guncel/sinemada-yeni-krizin-adi-tillyverse-yapay-zeka-aktris-kendi-kadrosunu-kuruyor_178193.html,https://img.chip.com.tr/rcman/Cw1280h720q95gm/storage/files/images/2026/03/03/yapay-zeka-aktris-tilly-norwood-tek-basina-degil-yeni-bir-yapay-zeka-oyuncu-kadrosu-yolda-qve9.jpg,,"Hollywood ve dijital içerik dünyası, yapay zekanın sınırlarını zorlayan yeni bir tartışmanın eşiğine geldi. Geçtiğimiz yaz ilk kez sahneye çıktığında sektörde büyük bir fırtına koparan yapay zeka ürü… [+2651 chars]",,2026-03-08 10:54:39+00:00,random,,,
63c9b58bba5f258dc0093011b2c0f005,2026-03-07T06:06:57Z,Snow Avalanche,çığ,www.sabah.com.tr,tr,0.9,"Die Meteorologie warnte nacheinander: Sturm, Schnee und Schauer kommen gleichzeitig! Die Generaldirektion Meteorologie teilte ihre neuesten Prognosen mit. Der Himmel bereitet heute verschiedene Szenarien für verschiedene Regionen der Türkei vor. An einer Stelle werden Schauer, an einer anderen Schnee und in einigen Meeren Stürme erwartet. Die Gefahr von Nebel, Vereisung und Lawinen macht aufmerksam...","Meteoroloji peş peşe uyardı: Fırtına, kar ve sağanak aynı anda geliyor!","Meteoroloji Genel Müdürlüğü son tahminlerini paylaştı. Gökyüzü bugün Türkiye’nin farklı bölgeleri için farklı senaryolar hazırlıyor. Bir yerde sağanak, başka bir yerde kar, bazı denizlerde ise fırtına bekleniyor. Sis, buzlanma ve çığ tehlikesi ise dikkat çeki…","Meteorology warned one after another: Storm, snow and showers are coming at the same time! General Directorate of Meteorology shared its latest forecasts. The sky is preparing different scenarios for different regions of Turkey today. Showers are expected in one place, snow in another, and storms in some seas. The danger of fog, icing and avalanche draws attention...","Meteorologia alia post alia monuit: Tempestas, nix et imbres simul veniunt! Directoratus generalis Meteorologiae suas praenuntiationes novissimas communicavit. Caelum diversis missionibus pro diversis Turciae regionibus hodie parat. Alio loco imbres, alibi nix, in quibusdam maria tempestatibus expectantur. Periculum nebulae, vico et NIVIS CAELI advertit...",https://www.sabah.com.tr/yasam/meteoroloji-pes-pese-uyardi-firtina-kar-ve-saganak-ayni-anda-geliyor-7538256,https://iasbh.tmgrup.com.tr/f29f86/1200/675/0/0/864/486?u=https://isbh.tmgrup.com.tr/sbh/2026/03/07/meteoroloji-pes-pese-uyardi-firtina-kar-ve-saganak-ayni-anda-geliyor-1772862978159.jpg,,"DOU ANADOLU
Çok bulutlu, bölge genelinin aralkl karla kark yamur ve kar yal geçecei tahmin ediliyor. Yalarn, bölgenin güneydousunda kuvvetli olmas bekleniyor. Bölge genelinde buzlanma ve don ile bir… [+461 chars]",,2026-03-08 10:54:39+00:00,random,,,
655c69e4aa94cc5648e5ca664a0fb9ae,2026-03-05T08:02:00Z,Precipitation,sağanak,www.haber7.com,tr,0.9,Der Winter kommt zurück! Warnung von AKOM an die Istanbuler: Achten Sie auf Samstag! Nach dem neuesten Meteorologiebericht werden in einigen Provinzen Schauer und Schneeregen erwartet. Laut AKOM wird es in Istanbul ab Samstag starke Winde und gelegentliche Schauer geben und die Temperatur wird unter 10 Grad fallen.,Kış geri geliyor! AKOM'dan İstanbullulara uyarı: Cumartesi gününe dikkat!,"Meteoroloji’nin son raporuna göre bazı illerde sağanak ve karla karışık yağmur bekleniyor. AKOM'a göre İstanbul’da cumartesi gününden itibaren şiddetli rüzgar ve yer yer sağanak yağış etkili olacak, sıcaklık 10 derece altına düşecek.","Winter is coming back! Warning from AKOM to Istanbulites: Watch out for Saturday! According to the latest report of Meteorology, showers and sleet are expected in some provinces. According to AKOM, strong winds and occasional showers will be effective in Istanbul starting from Saturday, and the temperature will drop below 10 degrees.","Hiems revertitur! Monitum ab AKOM ad Istanbulitis: Cavete ad Sabbatum! Secundum recentissimam relationem Meteorologicorum, imbres et pruinae in quibusdam provinciis expectantur. Secundum AKOM, venti fortes et imbres occasionales efficaces erunt in Istanbul incipiendo ab Sabbato, et temperatura infra 10 gradus decidet.",https://www.haber7.com/guncel/haber/3609406-kis-geri-geliyor-akomdan-istanbullulara-uyari-cumartesi-gunune-dikkat,https://i20.haber7.net/resize/1280x720//haber/haber7/photos/2020/03/rlQtL_1579004365_7688.gif,,"Meteoroloji Genel Müdürlüü tarafndan yaplan deerlendirmelere göre, bugün ülkemiz genelinin parçal ve çok bulutlu, sabah ilk saatlerde Van çevrelerinin hafif kar yal; akam ve gece saatlerinde Marmara … [+4590 chars]",,2026-03-08 20:54:30+00:00,random,,,
5e6668d915936ddb3665e6ec9b89aafd,2026-03-06T10:55:52Z,Earthquake,deprem,www.yenicaggazetesi.com,tr,0.9,"AFAD: Erdbeben im Balıkesir Sındırgı. Nach Angaben der AFAD ereignete sich im Bezirk Sındırgı von Balıkesir ein Erdbeben der Stärke 3,6.",AFAD: Balıkesir Sındırgı'da deprem,"AFAD'dan alınan bilgilere göre Balıkesir'in Sındırgı ilçesinde 3,6 büyüklüğünde deprem meydana geldi.","AFAD: Earthquake in Balıkesir Sındırgı. According to information received from AFAD, a 3.6 magnitude earthquake occurred in Sındırgı district of Balıkesir.","AFAD: Terraemotus in Balıkesir Sındırgı. Secundum informationes acceptas ab AFAD, magnitudo 3.6 terrae motus in regione Sındırgı facta est Balıkesir.",https://www.yenicaggazetesi.com/afad-balikesir-sindirgida-deprem-6-mart-2026-1006582h.htm,https://img.yenicaggazetesi.com/rcman/Cw1280h720q95gc/storage/files/images/2026/03/06/afad-balikesir-sindirgida-deprem-6-mart-2026-6wun.jpg,,"Afet ve Acil Durum Yönetimi Bakanl (AFAD), Balkesir'in Sndrg ilçesinde 3,6 büyüklüünde bir deprem meydana geldiini bildirdi.
AFAD'n resmi X hesabndan yaplan paylama göre, Balkesir'in Sndrg ilçesinde… [+78 chars]",,2026-03-09 03:23:20+00:00,random,,,
c52bba64c0b074dfcc9d989c08405062,2026-03-01T20:16:00Z,Snow Avalanche,çığ çeçen cumhuriyeti,spor.haber7.com,tr,0.3,Ehemalige Schiedsrichter machen Schluss mit der umstrittenen Position! „Es hätte eine Strafe geben müssen.“ Das gelb-dunkelblaue Team wartete im Spiel Antalyaspor gegen Fenerbahçe in der Super League auf einen Elfmeter. Schiedsrichter Alper Akarsu setzte das Spiel fort. Die Position sorgte in den sozialen Medien für Kontroversen. Ehemalige Schiedsrichter äußerten sich nach dem Spiel zu der Position.,Tartışmalı pozisyona eski hakemler son noktayı koydu! 'Penaltı verilmeliydi',"Süper Lig'de oynanan Antalyaspor-Fenerbahçe maçında sarı-lacivertli ekip penaltı bekledi. Hakem Alper Akarsu oyunu devam ettirdi. Pozisyon sosyal medyada tartışmalara sebep oldu. Eski hakemler, maçın ardından pozisyonu yorumladı.",Former referees put an end to the controversial position! 'Penalty should have been given'. The yellow-dark blue team waited for a penalty in the Antalyaspor-Fenerbahçe match played in the Super League. Referee Alper Akarsu continued the game. The position caused controversy on social media. Former referees commented on the position after the match.,Priores referendi positio controversiae finem imposuit! 'Poena dari debuit'. Turma flava-obscura caerulea poenam exspectavit in par Antalyaspor-Fenerbahçe in Eximio League lusit. Referendarius Alper Akarsu ludum continuavit. Positio controversiam de instrumentis socialibus effecit. Priores referendi commentati sunt de positione post par.,https://spor.haber7.com/super-lig/haber/3608402-tartismali-pozisyona-eski-hakemler-son-noktayi-koydu-penalti-verilmeliydi,https://i20.haber7.net/resize/1280x720//haber/haber7/photos/2026/09/0Dtzf_1772390207_532.jpg,,"Trendyol Süper Lig'in 24. haftasnda Fenerbahçe, deplasmanda Antalyaspor'a konuk oldu. Karlamann ikinci yarsnda Fenerbahçe cephesi penalt itirazlar yapt.
Antalyaspor ceza sahas içerisinde yaanan hava… [+712 chars]",,2026-03-09 06:39:40+00:00,wmo,Russia,ESB,Europe
39290ee7feba4ba56cc9f9b0845bbdb5,2026-03-03T05:24:00Z,Drought,kuraklık brezilya,www.hurriyet.com.tr,tr,0.3,"Schockierende Behauptung aus dem Iran: 40 US-Soldaten wurden getötet. Die Gruppe Seraya Evliya al-Dem, die der schiitischen Miliz Hashd al-Shaabi nahesteht, gab bekannt, dass sie einen Angriff auf das Hotel verübt habe, in dem sich angeblich US-Soldaten aufhielten. Die iranischen Revolutionsgarden behaupteten, bei dem Angriff auf Dubai seien 40 US-Soldaten getötet worden.",İran'dan şoke eden iddia: 40 ABD askeri öldürüldü,"Şii milis Haşdi Şabi’ye bağlı Seraya Evliya el-Dem grubu, ABD askerlerinin kaldığı öne sürülen otele saldırı düzenlediğini duyurdu. İran Devrim Muhafızları, Dubai'ye yönelik saldırıda 40 ABD askerinin öldürüldüğünü öne sürdü.","Shocking claim from Iran: 40 US soldiers were killed. The Seraya Evliya al-Dem group, affiliated with the Shiite militia Hashd al-Shaabi, announced that it carried out an attack on the hotel where US soldiers were allegedly staying. Iranian Revolutionary Guards claimed that 40 US soldiers were killed in the attack on Dubai.","Improbe clamorem Irania: XL milites US occisi sunt. Coetus Seraya Evliya al-Dem, confossus cum militia Shiite Hashd al-Shaabi, denuntiavit impetum in deversorium ubi US milites manere dicebatur. Custodes Revolutionis Iraniani affirmaverunt XL milites US milites in oppugnatione Dubai occisos esse.",https://www.hurriyet.com.tr/dunya/irandan-soke-eden-iddia-40-abd-askeri-olduruldu-43120218,https://image.hurimg.com/i/hurriyet/90/0x0/69a6706ceb59fdefaeb25639.jpg,,"Oluturulma Tarihi: Mart 03, 2026 08:24
p&gt;ABD ve ran arasndaki sava, Orta Dou'da çok sayda ülkeye sçrad. Bölgedeki ABD üslerine yönelik HA ve füze saldrlar gerçekletiren ran Devrim Muhafzlar, Körf… [+3480 chars]",,2026-03-09 06:39:40+00:00,wmo,Brazil,SAM,South-America
646f03925af3d45112fe52aea71ead75,2026-03-03T20:35:33Z,Snow&Ice,dondurucu Kanada,www.odatv.com,tr,0.3,Fidan erläuterte die Strategie des Iran. Außenminister Hakan Fidan sagte: „Die unterschiedslose Bombardierung all dieser Orte (Golfstaaten) durch den Iran ist eine unglaublich falsche Strategie.“,"Fidan, İran'ın izlediği stratejiyi açıkladı","Dışişleri Bakanı Hakan Fidan, ""İran'ın hiçbir ayrım yapmadan bütün buraları (Körfez ülkeleri) bombalaması inanılmaz derecede yanlış bir strateji"" dedi.","Fidan explained the strategy followed by Iran. Minister of Foreign Affairs Hakan Fidan said, ""Iran's bombing of all these places (Gulf countries) without any discrimination is an incredibly wrong strategy.""","Fidan consilium per Iran secutus explicavit. Minister rerum exterarum Hakan Fidan dixit ""Iran bombing ex omnibus his locis (Gulf nationibus) sine ullo discrimine belli incredibile malum est"".",https://www.odatv.com/guncel/fidan-iranin-izledigi-stratejiyi-acikladi-120138112,https://img.odatv.com/rcman/Cw1280h720q95gc/storage/files/images/2026/03/03/fidan-iranin-izledigi-stratejiyi-acikladi-buhc.jpg,,"Dileri BakanHakan Fidan, TRT'de katld canl yaynnda ABD ve srail'in ran'a yönelik saldrlar ve bölgedeki son duruma ilikin deerlendirmelerde bulundu.
Bakan Fidan, ""Sava ran'la snrl kalmyor, bölgenin t… [+4463 chars]",,2026-03-09 06:39:40+00:00,wmo,Canada,NEN,North-America
