index,published,topic,term,domain,language,valid,de,title,description,en,la,url,image,archive,content,quote,added,feed,country,ipcc,continent
e1e43f2508ccbecd87d9d7eeea909d40,2026-03-15T19:41:32Z,Volcano,volkan,www.yenicaggazetesi.com,tr,0.7,"Volkan Demirels Kommentar zur Roten Karte nach dem Beşiktaş-Spiel: „Es scheint schwer zu sein.“ Gençlerbirliği-Trainer Volkan Demirel gab nach der Niederlage gegen Beşiktaş eine Erklärung ab. Volkan Demirel argumentierte, dass die Rote Karte, die Sekou Koita in der 18. Minute des Spiels gesehen hatte, eine schwere Entscheidung sei und dass sie Teil des Spiels sein würden, wenn sie das Spiel nicht verpassen würden.",Volkan Demirel'den Beşiktaş maçı sonrası kırmızı kart yorumu: 'Ağır gibi',"Gençlerbirliği Teknik Direktörü Volkan Demirel, Beşiktaş mağlubiyetinin ardından açıklamalarda bulundu. Volkan Demirel karşılaşmanın 18. dakikasında Sekou Koita'nın gördüğü kırmızı kartın ağır bir karar olduğunu savunarak eksik kalmamaları durumunda oyunun fa…","Volkan Demirel's red card comment after the Beşiktaş match: 'It seems heavy'. Gençlerbirliği Coach Volkan Demirel made a statement after the Beşiktaş defeat. Volkan Demirel argued that the red card seen by Sekou Koita in the 18th minute of the match was a heavy decision and that if they did not miss the game, they would be part of the game.","Volkan Demirel commentarium rubrae chartae post Beşiktaş compositus: 'Grave videtur'. Gençlerbirliği Coach Volkan Demirel denuntiationem fecit post cladem Beşikta. Volkan Demirel disseruit cardum rubeum visum a Sekou Koita in 18 minutis par grave consilium fuisse et, si ludo non deesset, partem ludi essent.",https://www.yenicaggazetesi.com/volkan-demirelden-besiktas-maci-sonrasi-kirmizi-kart-yorumu-agir-gibi-1009460h.htm,https://img.yenicaggazetesi.com/rcman/Cw1280h720q95gc/storage/files/images/2026/03/15/volkan-demirelden-besiktas-maci-sonrasi-kirmizi-kart-yorumu-agir-gibi-5yxn.jpg,,"Trendyol Süper Lig'in 26. haftasnda evinde Beikta'a büyük bölümünü 10 kii oynad maçta 2-0 kaybeden Gençlerbirlii'nde teknik direktör Volkan Demirel maçn ardndan açklamalarda bulundu.
Volkan Demirel … [+801 chars]",,2026-03-21 06:05:34+00:00,random,,,
bd6169e6eb50d51803fdf22ef74be499,2026-03-15T20:34:58Z,Volcano,volkan,www.hurriyet.com.tr,tr,0.7,"Kommentar zur Roten Karte von Volkan Demirel: „Eine umstrittene Position!“. Gençlerbirliği-Trainer Volkan Demirel sagte nach dem Beşiktaş-Spiel: „Wir haben gut gekämpft, obwohl wir heute zu zehnt waren. Es hätte viel anders laufen können, wenn 11 gegen 11 gespielt worden wäre.“",Volkan Demirel'den kırmızı kart yorumu: 'Tartışmalı bir pozisyon!',"Gençlerbirliği Teknik Direktörü Volkan Demirel, Beşiktaş müsabakasının ardından, ""Biz bugün 10 kişi de olsak iyi mücadele ettik. 11'e 11 oynansaydı çok daha farklı olabilirdi"" dedi.","Red card comment from Volkan Demirel: 'A controversial position!'. Gençlerbirliği Coach Volkan Demirel said after the Beşiktaş match, ""We fought well even though we were 10 people today. It could have been much different if it had been played 11 against 11.""","Red card commentum de Volkan Demirel: 'Controversiae positionis!'. Gençlerbirliği Coach Volkan Demirel post par Beşiktaş dixit ""Bene pugnavimus quamquam hodie homines sumus 10",https://www.hurriyet.com.tr/sporarena/volkan-demirelden-kirmizi-kart-yorumu-tartismali-bir-pozisyon-43129518,https://image.hurimg.com/i/hurriyet/90/0x0/69b717b6fe458f6fc403958a.jpg,,"p&gt;Trendyol Süper Lig'in 26. haftasnda Gençlerbirlii, sahasnda arlad Beikta'a 2-0 malup oldu.Maç sonu düzenlenen basn toplantsnda deerlendirmelerde bulunan Gençlerbirlii Teknik Direktörü Volkan Dem… [+1446 chars]",,2026-03-21 06:05:34+00:00,random,,,
331f9f0ff5f0ba09c387f2f910f935a9,2026-03-16T04:51:12Z,Volcano,volkan,anlatilaninotesi.com.tr,tr,0.7,"Volkan Demirel nach dem Spiel Gençlerbirliği-Beşiktaş: Wenn das Spiel 11 gegen 11 weitergegangen wäre, wären wir sicher nicht besiegt worden. Volkan Demirel, der Trainer von Natura Dünyası Gençlerbirliği, der in der 26. Woche der Trendyol Super League zu Hause mit 0:2 gegen Beşiktaş verlor, sagte: „Ich bin nicht traurig, weil wir gegen Beşiktaş verloren haben, sondern weil unsere Rechte verletzt wurden.“ sagte er.",Gençlerbirliği-Beşiktaş maçının ardından Volkan Demirel: Maç 11'e 11 devam etseydi eminim ki mağlup olmazdık,"Trendyol Süper Lig'in 26. haftasında sahasında Beşiktaş'a 2-0 yenilen Natura Dünyası Gençlerbirliği'nin teknik direktörü Volkan Demirel, ""Beşiktaş'a yenildiğimiz için değil hakkımız yendiği için üzülüyorum."" dedi.","Volkan Demirel after the Gençlerbirliği-Beşiktaş match: If the match had continued 11 vs 11, I am sure we would not have been defeated. Volkan Demirel, the coach of Natura Dünyası Gençlerbirliği, who lost 2-0 to Beşiktaş at home in the 26th week of the Trendyol Super League, said, ""I am sad not because we lost to Beşiktaş, but because our rights were violated."" he said.","Volkan Demirel post par Gençlerbirliği-Beşiktaş: Si par mansisset 11 vs 11, certo scio nos victos non fuisse. Volkan Demirel, raeda Naturae Dünyası Gençlerbirliği, quae 2-0 Beşiktaş domi amisit in 26 septimana Trendyol Super foedus dixit, ""tristis sum non quod Beşiktaş amisimus, sed quia iura nostra violata sunt."" dixit.",https://anlatilaninotesi.com.tr/20260316/genclerbirligi-besiktas-macinin-ardindan-volkan-demirel-mac-11e-11-devam-etseydi-eminim-ki-maglup-1104276388.html,https://cdn.img.anlatilaninotesi.com.tr/images/sharing/article/tur/1104276388.jpg?11042764521773636672,,"Futbol turnuvalarndan uluslararas karlamalara, dünyann her noktasndan spor hakknda her ey.
https://anlatilaninotesi.com.tr/20260316/genclerbirligi-besiktas-macinin-ardindan-volkan-demirel-mac-11e-11… [+8834 chars]",,2026-03-21 06:05:34+00:00,random,,,
7e513b0358a12f05c04ba992ef5043c1,2026-03-18T16:17:25Z,Volcano,volkan,www.sabah.com.tr,tr,0.7,"Volkan Kazak: Diesen Punktestand werden wir nicht vergessen! Kocaelispors Co-Trainer Volkan Kazak bewertete das Spiel, in dem sie auswärts gegen Alanyaspor mit 0:5 verloren. Klicken Sie für mehr.",Volkan Kazak: Bu skoru unutmayacağız!,"Kocaelispor Yardımcı Antrenörü Volkan Kazak, Alanyaspor'a deplasmanda 5-0 mağlup oldukları maçı değerlendirdi.Devamı için tıklayınız",Volkan Kazak: We will not forget this score!. Kocaelispor Assistant Coach Volkan Kazak evaluated the match in which they lost 5-0 away to Alanyaspor. Click for more.,Volkan Kazak: Nos huius score non obliviscemur. Kocaelispor Suffragium Coach Volkan Kazak parem aestimavit in qua 5-0 in Alanyaspor amiserunt. Click for more.,https://www.sabah.com.tr/spor/futbol/2026/03/18/volkan-kazak-bu-skoru-unutmayacagiz,https://iasbh.tmgrup.com.tr/e08eea/1200/675/0/0/800/450?u=https://isbh.tmgrup.com.tr/sbh/2026/03/18/volkan-kazak-bu-skoru-unutmayacagiz-1773850642044.jpeg,,"Trendyol süper Lig'in 27. haftasnda deplasmanda Alanyaspor'a 5-0 malup olan Kocaelispor'un yardmc antrenörü Volkan Kazak, bu skoru unutmayacaklarn belirterek yantlarn en ksa sürede sahada verecekleri… [+958 chars]",,2026-03-21 06:05:34+00:00,random,,,
ecddddef7713706e26f624f16c2c62b3,2026-03-18T17:24:00Z,Volcano,volkan,spor.haber7.com,tr,0.7,"Nach der 0:5-Niederlage sagte der erfahrene Trainer: „Wir lassen uns nicht übertrumpfen.“ Der technische Manager von Kocaelispor, Volkan Kazak, sagte nach dem Spiel gegen Alanyaspor: „Wir werden dieses Ergebnis nicht vergessen. Aber wir werden auch nicht darunter bleiben. Wir planen, die Antwort erneut auf dem Spielfeld zu geben.“",5-0'lık yenilginin ardından tecrübeli hoca: 'Altında kalmayacağız',"Kocaelispor Teknik Sorumlusu Volkan Kazak, Alanyaspor maçının ardından, ""Bu skoru unutmayacağız. Fakat altında da kalmayacağız. Yanıtı da tekrar sahada vermeyi düşünüyoruz'' dedi.","After the 5-0 defeat, the experienced coach said: 'We will not be outdone'. Kocaelispor Technical Manager Volkan Kazak said after the Alanyaspor match, ""We will not forget this score. But we will not stay below it either. We plan to give the answer on the field again.""","Post cladem 5-0, varius peritus dixit: ""Nolumus vinci"". Kocaelispor Procurator Technical Volkan Kazak post par Alanyaspor dixit ""Nolumus huius score oblivisci. Sed infra illud non manebimus. Iterum in campo responsum dare cogitamus"".",https://spor.haber7.com/super-lig/haber/3613170-5-0lik-yenilginin-ardindan-tecrubeli-hoca-altinda-kalmayacagiz,https://i20.haber7.net/resize/1280x720//haber/haber7/photos/2026/12/5_0lik_yenilginin_ardindan_tecrubeli_hoca_altinda_kalmayacagiz_1773854648_5082.jpg,,"Trendyol Süper Lig'in 27. haftasnda Kocaelispor, Alanyaspor deplasmannda 5-0'lk farkl skor ile malup oldu. Maçn ardndan düzenlenen basn toplantsnda konuan Kocaelispor Teknik Sorumlusu Volkan Kazak, ""… [+615 chars]",,2026-03-21 06:05:34+00:00,random,,,
eb33e8b331f7abb60a3accc241324a43,2026-03-19T19:58:29Z,Volcano,volkan,www.sabah.com.tr,tr,0.7,"Volkan Demirel: „Wir hätten das Spiel mit einem Punkt verlassen können.“ Gençlerbirliği-Trainer Volkan Demirel sagte nach dem Spiel gegen Konyaspor, das sie mit 0:1 verloren hatten: „Wir hätten hier vielleicht mit einem Punkt abreisen können. Es tut mir leid, dass wir verloren haben.“ Klicken Sie für mehr.","Volkan Demirel: ""Maçtan 1 puanla ayrılabilirdik""","Gençlerbirliği Teknik Direktörü Volkan Demirel, 1-0 mağlup oldukları Konyaspor maçının ardından, ""Buradan belki 1 puanla ayrılabilirdik. Mağlup olduğumuz için üzgünüm"" dedi.Devamı için tıklayınız","Volkan Demirel: ""We could have left the match with 1 point"". Gençlerbirliği Coach Volkan Demirel said after the match against Konyaspor, where they lost 1-0, ""We could have left here with maybe 1 point. I'm sorry we lost."" Click for more.","Volkan Demirel: ""parem cum puncto 1 relinqui potuimus"". Gençlerbirliği Coach Volkan Demirel post certamen contra Konyasporem dixit, ubi 1-0 amiserunt, ""Posuimus hic reliquisse cum fortasse 1 puncto. Paenitet nos amisisse."" Click for more.",https://www.sabah.com.tr/spor/futbol/2026/03/19/volkan-demirel-mactan-1-puanla-ayrilabilirdik,https://iasbh.tmgrup.com.tr/1ec3d2/1200/675/0/0/800/449?u=https://isbh.tmgrup.com.tr/sbh/2026/03/19/konyaspor-genclerbirligi-macinin-ardindan-1773950245516.jpeg,,"Trendyol Süper Lig'in 27. haftasnda deplasmanda TÜMOSAN Konyaspor'a 1-0 yenilen Natura Dünyas Gençlerbirlii'nin teknik direktörü Volkan Demirel, karlamann ardndan açklamalarda bulundu.
Son 10 günde … [+943 chars]",,2026-03-21 06:05:34+00:00,random,,,
cbb3ce18beac11a0682cd7645711eeb6,2026-03-19T20:09:07Z,Volcano,volkan,www.hurriyet.com.tr,tr,0.7,"Volkan Demirel: „Wir hätten hier mit einem Punkt abreisen können.“ Volkan Demirel, der Trainer von Natura Dünyası Gençlerbirliği, der in der 27. Woche der Trendyol Super League auswärts gegen TÜMOSAN Konyaspor mit 0:1 verlor, sagte, dass ihm die Niederlage leid tue.",Volkan Demirel: 'Buradan 1 puanla ayrılabilirdik',"Trendyol Süper Lig'in 27. haftasında deplasmanda TÜMOSAN Konyaspor'a 1-0 yenilen Natura Dünyası Gençlerbirliği'nin teknik direktörü Volkan Demirel, mağlubiyetten ötürü üzgün olduğunu söyledi.","Volkan Demirel: 'We could have left here with 1 point'. Volkan Demirel, the coach of Natura Dünyası Gençlerbirliği, who lost 1-0 away to TÜMOSAN Konyaspor in the 27th week of Trendyol Super League, said that he was sorry for the defeat.","Volkan Demirel: 'Posuimus hic cum 1 puncto relinqui'. Volkan Demirel, raeda Naturae Dünyası Gençlerbirliği, quae 1-0 amisit ad TÜMOSAN Konyaspor in 27 septimana Trendyol Super foedus dixit se cladem dolere.",https://www.hurriyet.com.tr/sporarena/volkan-demirel-buradan-1-puanla-ayrilabilirdik-43132586,https://image.hurimg.com/i/hurriyet/90/0x0/69bc57e0a17c6fe03863e1ac.jpg,,"p&gt;Volkan Demirel, karlamann oynand Konya Büyükehir Stad'nda düzenlenen basn toplantsnda, son 10 günde 3 karlamann 2'sini deplasmanda oynadklarn anmsatt.Bu süreçte takmnn fiziksel mücadelesinden me… [+815 chars]",,2026-03-21 06:05:34+00:00,random,,,
4617058a68fac0ad39134dbf0550b7c5,2026-03-13T15:20:00Z,Heat Wave,ısı,www.odatv.com,tr,0.9,"„Linker“-Kommentar von Yüksel Baysal: Legen Sie Ihre Vorurteile in den Korb. Der Präsident der Contemporary Journalists Association Bursa, Yüksel Baysal, diskutierte in seinem Artikel mit dem Titel „Linke, die ihre Seelen nicht an den Teufel verkaufen“ das Buch des Journalisten und Schriftstellers Soner Yalçın „Linke sprechen mit Schweigen“.",Yüksel Baysal'dan 'Solcular' yorumu: Ön yargılarınızı sepete koyun,"Çağdaş Gazeteciler Derneği Bursa Başkanı Yüksel Baysal, ""Ruhlarını şeytana satmayan Solcular"" başlığıyla kaleme aldığı yazısında gazeteci-yazar Soner Yalçın'ın ""Solcular Sessizliğe Söz Düşenler"" kitabını ele aldı.","'Leftists' comment from Yüksel Baysal: Put your prejudices in the basket. Contemporary Journalists Association Bursa President Yüksel Baysal, in his article titled ""Leftists who do not sell their souls to the devil"", discussed journalist-writer Soner Yalçın's book ""Leftists Speak to Silence"".","'Leftists' commentarium e Yüksel Baysal: Praejudicia tua in canistro pone. Bursa Praeses Yüksel Baysal Contemporalis Consociationis Diurnarii, in articulo cui titulus ""Leftists, qui animas suas diabolo non vendunt"", disputavit diurnarius Soner de libro Yalçın ""Leftists Loquere Silentii"".",https://www.odatv.com/guncel/yuksel-baysaldan-solcular-yorumu-on-yargilarinizi-sepete-koyun-120139382,https://img.odatv.com/rcman/Cw1280h720q95gc/storage/files/images/2026/03/13/yuksel-baysaldan-solcular-yorumu-on-yargilarinizi-sepete-koyun-u4ks.jpg,,"Çada Gazeteciler Dernei Bursa Bakan Yüksel Baysal, Bursa Saati gazetesinde ""Ruhlarn eytana satmayan Solcular"" balyla bir yaz kaleme ald.Baysal yazsnda, gazeteci-yazar Soner Yalçn'n ""Solcular Sessizli… [+4700 chars]",,2026-03-21 06:05:34+00:00,random,,,
1e71aa20210fe4c419273db052b8e714,2026-03-13T19:47:19Z,Volcano,volkan,www.hurriyet.com.tr,tr,0.9,"Volkan Demirels Ziel ist der Sieg gegen Beşiktaş! Gençlerbirliğis Trainer Volkan Demirel erklärte, dass sie im Beşiktaş-Spiel um 3 Punkte kämpfen werden.",Volkan Demirel'in hedefi Beşiktaş karşısında galibiyet!,"Gençlerbirliği'nin teknik direktörü Volkan Demirel, Beşiktaş maçında 3 puan için mücadele edeceklerini belirtti.",Volkan Demirel's goal is to win against Beşiktaş! Gençlerbirliği's coach Volkan Demirel stated that they will fight for 3 points in the Beşiktaş match.,Volkan Demirel propositum est vincere contra Beşiktaş! Raeda Gençlerbirliği Volkan Demirel affirmavit se pugnaturos pro 3 punctis in par Beşikta.,https://www.hurriyet.com.tr/sporarena/volkan-demirelin-hedefi-besiktas-karsisinda-galibiyet-43128339,https://image.hurimg.com/i/hurriyet/90/0x0/69b469c5ce1c2a9cf8a73702.jpg,,"p&gt;Gençlerbirlii'nin 103. yl etkinlii kapsamnda düzenlenen iftar programna katlan Volkan Demirel, ""nallah tüm camiamza, 103. ylmz hayrl uurlu olur. Burada olmaktan da son derece mutluyuz. ftarmz ya… [+2763 chars]",,2026-03-21 06:05:34+00:00,random,,,
8391cf286d2ccd4b6fa1a098647f38ac,2026-03-16T09:26:44Z,Heat Wave,ısı,www.hurriyet.com.tr,tr,0.9,"Emotionaler Beitrag von Volkan Konaks Frau Selma Konak: Ich weiß nicht, dass ich nach 14 Tagen ohne dich sein werde. Selma Konak, die einen tiefen Trauerprozess durchlief, nachdem sie ihren 33-jährigen Lebenspartner Volkan Konak verloren hatte, hält die Erinnerung an ihren Mann weiterhin mit ihren Social-Media-Beiträgen wach. Konak teilte mit seinen Followern das Video seines letzten Geburtstages, den er dieses Mal mit seiner Frau feierte ...",Volkan Konak'ın eşi Selma Konak'tan duygulandıran paylaşım:14 gün sonra sensiz kalacağımı bilmeden,"33 yıllık hayat arkadaşı Volkan Konak’ı kaybettikten sonra derin bir yas süreci yaşayan Selma Konak, sosyal medya paylaşımlarıyla eşinin anısını yaşatmaya devam ediyor. Konak, bu kez eşiyle birlikte kutladığı son doğum gününe ait videoyu takipçileriyle paylaş…","Emotional share from Volkan Konak's wife, Selma Konak: Not knowing that I will be without you after 14 days. Selma Konak, who went through a deep mourning process after losing her life partner of 33 years, Volkan Konak, continues to keep her husband's memory alive with her social media posts. Konak shared with his followers the video of his last birthday, which he celebrated with his wife this time...","Motus participes ab uxore Volkan Konak Selma Konak: Nesciens me post XIV dies sine te esse. Selma Konak, qui per magnum luctum processum abiit, postquam consortem vitae 33 annorum Volkan Konak amisit, pergit ut memoriam mariti sui vivam cum instrumentis socialibus suis custodiat. Konak communicavit cum suis video natali suo ultimo, quem celebravit hoc tempore cum uxore sua.",https://www.hurriyet.com.tr/kelebek/hayat/volkan-konakin-esi-selma-konaktan-duygulandiran-paylasim-14-gun-sonra-sensiz-kalacagimi-bilmeden-43129828,https://image.hurimg.com/i/hurriyet/90/0x0/69b7cca32e1c5c3a88eb626c.jpg,,"p&gt;Türkiye, usta sanatç Volkan Konak 31 Mart 2025te sahnede geçirdii kalp krizi sonucu kaybetmiti. Ani veda, sanatçnn hayranlarn derinden sarsarken en büyük acy ei Selma Konak ve çocuklar yaamt.Ein… [+732 chars]",,2026-03-21 06:05:34+00:00,random,,,
1bdef02ec141fddb169c65ecb603b50a,2026-03-19T21:38:38Z,Heat Wave,ısı,www.yenicaggazetesi.com,tr,0.9,"Botschaft des Wandels von Özgür Özel: „Türkiye erlebt Geburtswehen für eine neue Regierung.“ CHP-Vorsitzender Özgür Özel erklärte beim Iftar-Programm, an dem er in Saraçhane teilnahm, dass sich die Türkei in einem Veränderungsprozess befinde und sagte: „Die Geburtswehen einer neuen Regierung erleben.“",Özgür Özel'den değişim mesajı: “Türkiye yeni bir iktidar için doğum sancısı çekiyor”,"CHP Genel Başkanı Özgür Özel, Saraçhane’de katıldığı iftar programında Türkiye’nin bir değişim sürecinde olduğunu belirterek “Yeni bir iktidarın doğum sancıları yaşanıyor” dedi.","Message of change from Özgür Özel: ""Türkiye is experiencing birth pains for a new government."" CHP Chairman Özgür Özel, at the iftar program he attended in Saraçhane, stated that Turkey is in a process of change and said, ""The birth pains of a new government are experiencing.""","Nuntius mutationis ab Özgür Özel: ""Türkiye experitur dolores partus novo regimine"". CHP Praeses Özgür Özel, in progressione ifta, quam Saraçhane frequentavit, affirmavit Turciam in processu mutationis esse et dixit ""Pœnas partus novi imperii experiuntur.""",https://www.yenicaggazetesi.com/ozgur-ozelden-degisim-mesaji-turkiye-yeni-bir-iktidar-icin-dogum-sancisi-cekiyor-1010667h.htm,https://img.yenicaggazetesi.com/rcman/Cw1280h720q95gc/storage/files/images/2026/03/20/ozgur-ozelden-degisim-mesaji-turkiye-yeni-bir-iktidar-icin-dogum-sancisi-cekiyor-69ry.jpg,,"CHP Genel Başkanı Özgür Özel, Ramazan ayının son iftar programına İstanbul Saraçhane’de katıldı. Silivri Cezaevi’nde tutuklu bulunan Ekrem İmamoğlu’nu ziyaretinin ardından programa gelen Özel, burada… [+4825 chars]",,2026-03-21 06:05:34+00:00,random,,,
668efc7d80ab3e23c2438c859c865a0e,2026-03-17T06:31:41Z,Precipitation,yağmur brezilya,www.yenicaggazetesi.com,tr,0.3,"Selçuk Geçer nannte das Datum: Machen Sie sich bereit... Sie werden schockiert sein, wenn Sie den Goldpreis hören. Eine bahnbrechende Goldanalyse kam von Selçuk Geçer. Für eine Unze Gold gab Geçer die Passwörter seiner 10.000-Dollar-Reise preis.",Selçuk Geçer tarih verdi: Hazır olun… Altın fiyatını duyunca şok geçireceksiniz,"Selçuk Geçer’den ezber bozan altın analizi geldi. Ons altın için Geçer, 10 bin dolar yolculuğunun şifrelerini verdi.","Selçuk Geçer gave the date: Get ready... You will be shocked when you hear the gold price. A game-changing gold analysis came from Selçuk Geçer. For an ounce of gold, Geçer gave the passwords of his 10 thousand dollar journey.","Selçuk Geçer dedit diem: Para... Stupefactus eris cum audis pretium auri. Analysis lusus mutabilis auri accessit a Selçuk Geçer. Pro uncia auri, Geçer Tesserae X milia dollarorum sui itineris dedit.",https://www.yenicaggazetesi.com/selcuk-gecer-tarih-verdi-hazir-olun-altin-fiyatini-duyunca-sok-gecireceksiniz-1009851h.htm,https://img.yenicaggazetesi.com/rcman/Cw1280h720q95gc/storage/files/images/2026/03/17/selcuk-gecer-tarih-verdi-hazir-olun-altin-fiyatini-duyunca-sok-gecireceksiniz-zks7.jpg,,"Ekonomi dünyasının keskin yorumlarıyla tanınan ismi Selçuk Geçer, altın piyasalarındaki durgunluğun fırtına öncesi sessizlik olduğunu iddia etti. Mevcut risklerin altını agresif bir yükselişe hazırla… [+1424 chars]",,2026-03-21 10:56:29+00:00,wmo,Brazil,SAM,South-America
cacfe9e4e4260a41e1714563fe765f9e,2026-03-18T07:16:00Z,Storm,fırtına,spor.haber7.com,tr,0.7,"Sturm kann die Schusslinie verwirren! Eyüpspor - Trabzonspor: Mögliche 11er. Trabzonspor spielt in der 27. Woche der Super League auswärts gegen Eyüpspor, das in der Abstiegszone steht.","Fırtına, ateş hattını karıştırabilir! Eyüpspor - Trabzonspor: Muhtemel 11'ler","Trabzonspor, Süper Lig'in 27. haftasında bugün küme düşme hattında yer alan Eyüpspor ile deplasmanda mücadele edecek.","Storm can confuse the line of fire! Eyüpspor - Trabzonspor: Possible 11's. Trabzonspor will play away against Eyüpspor, which is in the relegation zone, in the 27th week of the Super League.","Tempestas linea ignis potest confundere! Eyüpspor - Trabzonspor: Possibile 11 s. Trabzonspor contra Eyüpspor ludet, quod est in zona relegationis, in 27 septimana Super foedus.",https://spor.haber7.com/super-lig/haber/3612747-firtina-ates-hattini-karistirabilir-eyupspor-trabzonspor-muhtemel-11ler,https://i20.haber7.net/resize/1280x720//haber/haber7/photos/2026/12/trabzonspor_ates_hattini_karistirabilir_4_isim_sari_kart_gorurse_gsaray_macinda_yok_1773737345_5625.jpg,,"Trabzonspor, Trendyol Süper Lig'in 27. haftasnda ikas Eyüpspor ile deplasmanda mücadele edecek.
Recep Tayyip Erdoan Stad'nda saat 20.00'de balayacak karlamay hakem Ouzhan Çakr, yönetecek.
Ligde 57 … [+1049 chars]",,2026-03-21 10:56:29+00:00,random,,,
6a1302b9c230c77304bf1b6c4d31eaef,2026-03-18T18:54:00Z,Storm,fırtına,spor.haber7.com,tr,0.7,Storm ist bereit für das große Spiel! Sie kehrten mit 3 Punkten aus dem Auswärtsspiel zurück und stiegen ins Rennen ein. In der 27. Woche der Trendyol Super League besiegte Trabzonspor Eyüpspor auswärts mit 1:0.,Fırtına dev maça hazır! Deplasmandan 3 puanla dönüp yarışa ortak oldular,"Trendyol Süper Lig'in 27. haftasında Trabzonspor, deplasmanda Eyüpspor'u 1-0 mağlup etti.","Storm is ready for the big match! They returned from the away game with 3 points and joined the race. In the 27th week of Trendyol Super League, Trabzonspor defeated Eyüpspor 1-0 away.",Tempestas magna par parata est! Redierunt ab lusu cum 3 punctis et cum stadio. XXVII septimana Trendyol Super foedus Trabzonspor Eyüpspor 1-0 victus est.,https://spor.haber7.com/super-lig/haber/3613163-firtina-dev-maca-hazir-deplasmandan-3-puanla-donup-yarisa-ortak-oldular,https://i20.haber7.net/resize/1280x720//haber/haber7/photos/2026/12/firtina_derbiye_hazir_deplasmandan_3_puanla_donup_yarisa_ortak_oldular_1773859911_6966.jpg,,"Trendyol Süper Lig'in 27. haftasnda Eyüpspor, sahasnda Trabzonspor'u konuk etti. Recep Tayyip Erdoan Stadyumu'nda oynanan mücadeleyi bordo-mavili ekip 1-0 kazand.
Trabzonspor'un golünü 66'nc dakikad… [+964 chars]",,2026-03-21 10:56:29+00:00,random,,,
fd2013ea3019dd776507a3e64ed8bf40,2026-03-16T11:18:26Z,Storm,fırtına,www.sabah.com.tr,tr,0.9,"Unwetterwarnung in den USA: Etwa 100 Millionen Menschen betroffen. Wegen der Gefahr starker Schneefälle und Stürme, von denen mehr als 100 Millionen Menschen betroffen sind, wurde in den nördlichen Bundesstaaten der USA eine Unwetterwarnung ausgegeben. Klicken Sie für mehr.",ABD’de şiddetli hava durumu alarmı: Yaklaşık 100 milyon kişi etkilendi,ABD'nin kuzey kesimindeki eyaletlerde şiddetli kar yağışı ve fırtına riski nedeniyle 100 milyonu aşkın kişiyi etkileyen ciddi hava durumu uyarısı yapıldı.Devamı için tıklayınız,"Severe weather alert in the USA: Approximately 100 million people affected. A severe weather warning has been issued in the northern states of the USA due to the risk of heavy snowfall and storms, affecting more than 100 million people. Click for more.","Tempestas gravis in USA vigilat: Proxime C miliones hominum afficiuntur. Gravis tempestas denuntiatum est in civitatibus septentrionalibus USA propter periculum gravis nix et tempestatum, plus quam C miliones hominum afficientes. Click for more.",https://www.sabah.com.tr/dunya/abdde-siddetli-hava-durumu-alarmi-yaklasik-100-milyon-kisi-etkilendi-7544294,https://iasbh.tmgrup.com.tr/1d1083/1200/675/0/110/1411/902?u=https://isbh.tmgrup.com.tr/sbh/2026/03/16/abdde-siddetli-hava-durumu-alarmi-yaklasik-100-milyon-kisi-etkilendi-1773659893799.png,,"ABD'nin Nebraska eyaletinde orman yangnlar sürerken ülkenin kuzeyinde frtna uyarlar veriliyor.
ABC News'in haberine göre Wisconsin, Minnesota, Michigan gibi eyaletlerin olduu ""Great Lakes"" bölgesi v… [+564 chars]",,2026-03-21 10:56:29+00:00,random,,,
